title,url,channel,duration,views,publish_time,description,thumbnail
PILATES TEACHER REVIEW | my story on becoming a pilates instructor and my opinion on the career,https://www.youtube.com/watch?v=hBw7ZzA2iwg,Aileen Michele,14m 38s,"42,652 views",2023-10-18T19:26:39Z,"hello friend! my name is aileen and i am a nationally certified pilates instructor and entrepreneur in miami who loves golf, running ...",https://i.ytimg.com/vi/hBw7ZzA2iwg/hqdefault.jpg
watch me get HUMBLED during Pilates,https://www.youtube.com/watch?v=NpRKZ8sI3b8,Callie Jardine Gualy,8s,"3,786,585 views",2024-08-13T18:00:11Z,Join my Pilates studio for 250+ on-demand workouts! https://sweatystudio.com/join ✨ SUBSCRIBE https://bit.ly/3JibyM1 ...,https://i.ytimg.com/vi/NpRKZ8sI3b8/hqdefault.jpg
Introduction to Pilates - Workout 1 | NHS,https://www.youtube.com/watch?v=44HquH6QyXc,NHS,31m 23s,"1,050,023 views",2020-05-20T09:05:07Z,"Keep safe, while keeping active. View our safety video before you begin this workout: ...",https://i.ytimg.com/vi/44HquH6QyXc/hqdefault.jpg
Day in the life as an SLT pilates instructor | NYC Fitness Vlog,https://www.youtube.com/watch?v=6CwzyELSPDU,"XO Melissa Bartow | Health, Wellness, Wanna Date? ",16m 26s,"2,580 views",2022-04-13T12:12:36Z,Training & Coaching (work with me!),https://i.ytimg.com/vi/6CwzyELSPDU/hqdefault.jpg
keep practicing 🖤 #pilates #newyork #nyc #fypシ #pilatesinstructor,https://www.youtube.com/watch?v=1GwbW57bYf0,ladyployploy,11s,"2,523 views",2023-08-09T12:25:52Z,,https://i.ytimg.com/vi/1GwbW57bYf0/hqdefault.jpg
Full Body Workout &amp; Ab Flow | Melissa Wood Health,https://www.youtube.com/watch?v=Y-OWS3jbLWM,Melissa Wood Health,10m 20s,"647,891 views",2019-04-04T14:32:40Z,"This is a shortened version of the flows I have on my website, melissawoodhealth.com. Sign up now to start your 5 day free trial!",https://i.ytimg.com/vi/Y-OWS3jbLWM/hqdefault.jpg
"15-Minute Melissa Wood Health Full-Body, No-Equipment Workout | Goop",https://www.youtube.com/watch?v=Y1SDEkrMrUc,goop,13m 11s,"351,061 views",2020-05-19T21:57:21Z,"Melissa Wood Tepperberg has a lot of fans at goop HQ. Or more accurately these days, across Slack channels whenever the topic ...",https://i.ytimg.com/vi/Y1SDEkrMrUc/hqdefault.jpg
Reformer Pilates vs. Lagree Megaformer: breaking down the difference!,https://www.youtube.com/watch?v=Z414HcUphI0,Jen Lauren,12m 26s,"45,366 views",2024-03-21T12:22:15Z,"Lagree Megaformer vs Reformer Pilates Breakdown | the differences, the workout + more In this video, we're finally bringing the ...",https://i.ytimg.com/vi/Z414HcUphI0/hqdefault.jpg
CLASSICAL VS CONTEMPORARY PILATES - DIFFERENCES AND BENEFITS,https://www.youtube.com/watch?v=l-ws4eCOG3o,Yahoo Southeast Asia,5m 9s,"5,161 views",2023-10-18T07:26:11Z,"If you are entering your #pilatesprincess era, learn about the differences between the two pilates forms and how you should push ...",https://i.ytimg.com/vi/l-ws4eCOG3o/hqdefault.jpg
