date,category,information,score
2024-06-06,emerging_topics,Budget-conscious urban tourism and 'hidden gem' local experiences,0.8
2024-06-06,emerging_topics,Traditional brick-and-mortar bookstores without adaptation,-0.8
2013-03-07,emerging_topics,Cultural neighborhood authenticity and local identity as tourism draws,0.8
2013-03-07,emerging_topics,Sustainable urban mobility and 24/7 transit systems,0.8
2013-03-07,emerging_topics,Cultural diversity and immigrant influence driving urban innovation,0.8
2024-06-06,emerging_topics,"Multi-use retail spaces combining commerce, culture and community gathering",0.8
2024-06-06,emerging_topics,Physical bookstores evolving into cultural brand destinations rather than just retail,0.8
2024-06-06,emerging_topics,Growing demand for phone-free entertainment experiences to combat digital distraction,0.8
2024-06-06,emerging_topics,Experiential retail and dining concepts combining entertainment with commerce,0.8
2024-06-06,emerging_topics,Experience-based dining over traditional restaurants,0.8
2024-06-06,emerging_topics,Urban waterfront development and activation,0.8
2024-06-06,emerging_topics,Budget-conscious urban dining experiences,0.8
2024-06-06,emerging_topics,Value-oriented dining in high-cost cities,0.8
2024-06-06,emerging_topics,Free/low-cost luxury brand experiences as marketing strategy,0.8
2024-06-06,emerging_topics,Sustainability focus through public transit and reusable water bottles,0.8
2024-06-06,emerging_topics,Budget-conscious urban tourism and local experiences gaining popularity,0.8
2024-03-13,educational_demand,Knowledge gap around theater/Broadway venue logistics and ticket purchasing,0.8
2024-03-13,educational_demand,Need for consumer education on official ticketing websites vs. resellers to avoid scams,0.8
2024-06-06,emerging_topics,Social media-driven discovery of urban experiences and money-saving hacks,0.8
2013-03-07,emerging_topics,Neighborhood-based cultural preservation and identity,0.8
2024-06-06,emerging_topics,Immersive escape room experiences and interactive entertainment,0.8
2024-03-13,emerging_topics,Rise of alternative neighborhoods over traditional tourist hotspots,0.7
2024-03-13,emerging_topics,Battery life optimization in wireless devices,0.7
2024-03-13,emerging_topics,Inter-jurisdictional disputes over urban policy implementation,0.7
2021-11-09,behavioral_patterns,Rooftop venues and elevated outdoor spaces gaining popularity for social gatherings,0.7
2024-03-13,emerging_topics,Rising utility/energy costs impacting urban households,0.7
2024-03-13,emerging_topics,Shift in desirability of secondary urban markets,0.7
2024-03-13,emerging_topics,Growing demand for electric/sustainable transportation options,0.7
2024-03-13,emerging_topics,Declining relevance of traditional airport bus services,-0.7
2024-03-13,problem_spaces,Time Square renovation project requiring massive $500M investment indicates significant infrastructure upgrade needs,0.7
2024-03-13,problem_spaces,Outdoor dining restrictions during winter months (Nov 30-Mar 31) limit restaurant operations due to snow plowing needs,0.7
2024-03-13,problem_spaces,Limited visibility/awareness of quality outer borough restaurants before Manhattan expansion,0.7
2024-03-13,problem_spaces,Limited crown access tickets for Statue of Liberty requiring months of advance booking,0.7
2024-03-13,emerging_topics,Peak hour transportation demand management,0.7
2024-03-13,emerging_topics,Real-time price transparency in transportation,0.7
2024-03-13,emerging_topics,Alternative transportation/ride solicitation outside official channels,0.7
2024-03-13,emerging_topics,Digital transit information systems replacing analog timetables,0.7
2021-11-09,behavioral_patterns,Growing Asian community clustering around cultural amenities/services in Queens,0.7
2024-03-13,emerging_topics,Integration of transit information with mobile technology,0.7
2024-03-13,emerging_topics,Integration of real-time service disruption data into navigation apps,0.7
2024-03-13,emerging_topics,Shift toward automated/self-service while still requesting tips,0.7
2024-03-13,emerging_topics,Growth of mobile apps for travel planning and ticket purchasing,0.7
2024-03-13,emerging_topics,Consolidation of transit and general payment systems,0.7
2024-03-13,emerging_topics,Automated fare optimization systems,0.7
2024-03-13,emerging_topics,Dynamic fare capping vs traditional unlimited passes,0.7
2024-03-13,problem_spaces,Airport taxi scams targeting tourists with unlicensed cars and price gouging,0.7
2024-03-13,emerging_topics,Traditional metro card systems,-0.7
2024-03-13,emerging_topics,Multi-modal transit integration (connecting different transport types),0.7
2024-03-13,emerging_topics,Space optimization in dense urban environments,0.7
2024-03-13,emerging_topics,Digital wayfinding and real-time transit navigation,0.7
2021-11-09,behavioral_patterns,Gentrification driving transformation of Williamsburg into trendy retail/dining destination,0.7
2021-11-09,behavioral_patterns,Rental market pushing residents toward smaller living spaces,0.7
2024-03-13,emerging_topics,Growing importance of immigrant-owned businesses and cultural authenticity,0.7
2024-03-13,problem_spaces,"Tipping confusion for international tourists, especially at bars",0.7
2024-03-13,emerging_topics,Growing anti-tipping movement and consumer resistance to tipping culture,0.7
2024-03-13,problem_spaces,Overcrowding in tourist areas affecting local quality of life,0.7
2024-03-13,problem_spaces,Growing traffic congestion making car rides slower than subway,0.7
2024-03-13,problem_spaces,Crowding during rush hour makes entering/exiting trains difficult,0.7
2024-03-13,problem_spaces,Confusion around Omni pay system and how it works,0.7
2021-11-09,behavioral_patterns,Growing preference for experiential tourism like doorless helicopter rides over static observation points,0.7
2024-03-13,emerging_topics,Formal dress codes becoming less relevant for entertainment venues,-0.7
2024-03-13,emerging_topics,Rise of automatic service charges and wellness fees in hospitality,0.7
2021-11-09,behavioral_patterns,Changing character of Little Italy with declining authenticity due to Chinatown influence,-0.7
2024-03-13,problem_spaces,"Multiple stations with same name (e.g., Spring Street, 23rd Street, Canal Street) cause confusion for travelers",0.7
2021-11-09,behavioral_patterns,Marijuana smoking in public spaces becoming more prevalent and normalized,0.7
2021-11-09,behavioral_patterns,Growing adaptation of old industrial infrastructure into public spaces (High Line example),0.7
2024-03-13,problem_spaces,Tourist overcrowding and lack of awareness about unique nighttime attractions like the midnight moment,0.7
2021-11-09,behavioral_patterns,Increasing importance of 360-degree panoramic views in observatory design,0.7
2021-11-09,behavioral_patterns,Rising parking costs ($550/month) driving behavior change,0.7
2021-11-09,behavioral_patterns,Declining car practicality in Manhattan due to high tolls and parking challenges,-0.7
2021-11-09,behavioral_patterns,Urban density driving pedestrian-based transportation patterns,0.7
2021-11-09,behavioral_patterns,Increasing safety concerns and violent incidents in subway system,0.7
2021-11-09,behavioral_patterns,Physical metro card system becoming obsolete as contactless payments rise,-0.7
2021-11-09,behavioral_patterns,Rising gentrification patterns changing neighborhood demographics and safety,0.7
2024-03-13,emerging_topics,Automated fare enforcement and contactless payment systems,0.7
2024-03-13,problem_spaces,Finding peaceful spaces within NYC's busy urban environment is challenging for locals,0.7
2024-03-13,problem_spaces,Access to affordable housing in desirable areas like West Village is severely limited due to high costs,0.7
2024-03-13,problem_spaces,Tourist groups blocking sidewalk traffic flow by walking in large groups,0.7
2024-03-13,emerging_topics,Digital transit payment systems and fare capping becoming mainstream,0.7
2024-03-13,emerging_topics,Cultural sensitivity and social norms adaptation,0.7
2024-03-13,emerging_topics,Shift toward dynamic/variable pricing models for urban services,0.7
2024-03-13,emerging_topics,Time-based transportation decision making,0.7
2024-03-13,early_adopter_products,D Deli (from Queens) opened new Lower East Side Manhattan location,0.7
2024-03-13,emerging_topics,Digital etiquette and device-free experiences,0.7
2024-06-06,emerging_topics,Experience-based tourism shifting toward customization and personalization,0.7
2024-06-06,emerging_topics,Mobile app-based transportation services expanding into new markets,0.7
2024-06-06,emerging_topics,Aggressive promotional pricing in ride-sharing market to gain market share,0.7
2024-06-06,emerging_topics,Safety-focused autonomous vehicle features becoming standard in ride-sharing,0.7
2024-06-06,emerging_topics,Immersive wellness experiences combining multiple modalities,0.7
2024-06-06,emerging_topics,Wellness tourism and urban retreat experiences growing in urban centers,0.7
2024-06-06,emerging_topics,Affordable urban water transportation gaining popularity as alternative commuting option,0.7
2024-06-06,emerging_topics,"Hybrid retail concepts combining shopping, dining, and local artisans gaining traction",0.7
2024-06-06,emerging_topics,Experiential dining and hidden/speakeasy venues continue trending upward,0.7
2024-06-06,emerging_topics,Rising demand for more accessible/casual theater experiences,0.7
2024-06-06,emerging_topics,Integration of social media-worthy moments in tourist attractions,0.7
2024-06-06,emerging_topics,QR code integration in physical exhibits for additional digital content,0.7
2024-06-06,emerging_topics,Budget-conscious tourism trends in expensive cities,0.7
2024-06-06,emerging_topics,Historic industrial/institutional areas transforming into luxury residential developments,0.7
2024-06-06,emerging_topics,Urban food affordability through traditional local options (vs chains),0.7
2024-06-06,emerging_topics,Authentic local food experiences at accessible price points,0.7
2024-06-06,emerging_topics,Pay-what-you-wish museum pricing models,0.7
2024-06-06,emerging_topics,Cultural institution accessibility initiatives,0.7
2024-06-06,emerging_topics,Artist collaboration with luxury brands,0.7
2024-06-06,emerging_topics,Repurposed industrial spaces into entertainment venues,0.7
2024-06-06,emerging_topics,Food hall/market concepts with multiple vendors,0.7
2024-06-06,emerging_topics,Multi-purpose entertainment destinations,0.7
2024-06-06,emerging_topics,Referral-based reward systems driving viral customer acquisition,0.7
2024-06-06,emerging_topics,Last-minute booking and dynamic pricing platforms enabling discounted luxury experiences,0.7
2024-06-06,emerging_topics,"Increasing value of live, unrecorded performances in social media era",0.7
2024-06-06,emerging_topics,Rise of 'pay what you wish' and accessibility-focused pricing models in cultural institutions,0.7
2024-03-13,early_adopter_products,Universal Hip-Hop Museum with $80M digital exhibits and online streaming capabilities,0.7
2024-03-13,early_adopter_products,NYC subway system (specifically 4/5 express lines) as preferred transport,0.7
2024-03-13,early_adopter_products,Phone-based tap payments and chip cards becoming primary transit payment method,0.7
2024-03-13,problem_spaces,Address confusion between Manhattan/Brooklyn/NJ causing accidental wrong destinations,0.7
2024-03-13,early_adopter_products,MetroCard machines and infrastructure becoming obsolete,-0.7
2024-03-13,early_adopter_products,MetroCard becoming obsolete except for JFK AirTrain,-0.7
2024-03-13,early_adopter_products,Contactless credit cards for transit payments,0.7
2024-03-13,early_adopter_products,Subway digital information boards showing real-time train arrivals,0.7
2024-03-13,early_adopter_products,NYC subway station accessibility/elevators (only 36 of 147 Manhattan stations accessible),-0.7
2024-03-13,early_adopter_products,Omni contactless payment for NYC subway fares,0.7
2024-03-13,early_adopter_products,T-Mobile retail stores in Manhattan offer cheaper SIM cards ($15-30) vs airport kiosks ($45),0.7
2024-03-13,early_adopter_products,Counterfeit ticket scams and scalper schemes using clipboards are increasing around Broadway,0.7
2024-03-13,early_adopter_products,Social media photo/video restrictions in theaters becoming more strictly enforced,0.7
2024-03-13,early_adopter_products,"MTA implementing anti-'back cocking' turnstile mechanics in 3,479 stations",0.7
2024-03-13,early_adopter_products,ConEd electricity billing system,0.7
2024-03-13,early_adopter_products,MTA Bridge/Tunnel electronic tolling systems,0.7
2024-03-13,early_adopter_products,NYC electricity rates - scheduled increases through 2025,0.7
2024-06-06,emerging_topics,Social media-driven tourism spots creating overcrowding challenges,0.7
2024-06-06,emerging_topics,"Digital integration in traditional tourist experiences (interactive windows, photo opportunities)",0.7
2024-06-06,emerging_topics,"Integration of technology with traditional cultural experiences (interactive exhibits, digital guides)",0.7
2024-06-06,emerging_topics,Emphasis on authentic local experiences over traditional tourist attractions,0.7
2024-06-06,emerging_topics,Rising trend of experiential budget tourism focusing on authentic local experiences,0.7
2024-06-06,emerging_topics,Trend toward guided local experiences and neighborhood-specific tourism,0.7
2024-03-13,emerging_topics,Volunteer tourism and social impact travel,0.7
2021-11-09,educational_demand,Skills gap in platform safety infrastructure implementation,0.7
2021-11-09,educational_demand,Increasing need for public safety and security management training given mentioned incidents and concerns,0.7
2021-11-09,educational_demand,Tourism industry workers need cultural competency training to serve growing Asian immigrant communities,0.7
2021-11-09,educational_demand,Financial markets education/certification requirements for Wall Street careers,0.7
2021-11-09,educational_demand,Urban planning and development expertise needs due to population density,0.7
2024-03-13,early_adopter_products,Luchas of Avenue X opened new Soho location on Canal Street,0.7
2024-03-13,emerging_topics,Architectural tourism and design-focused experiences,0.7
2024-03-13,emerging_topics,Interactive observation decks with multi-sensory elements,0.7
2024-03-13,emerging_topics,"Pre-booked, limited-capacity exclusive experiences",0.7
2024-03-13,emerging_topics,Height-based thrill experiences in urban settings,0.7
2024-03-13,emerging_topics,Permanent outdoor dining infrastructure becoming institutionalized post-pandemic,0.7
2024-03-13,emerging_topics,Social media viral food trends driving business expansion decisions,0.7
2024-03-13,emerging_topics,Integration of technology with traditional arts and culture,0.7
2024-03-13,emerging_topics,Public space transformation and urban waterfront development,0.7
2024-03-13,emerging_topics,Focus on inclusive and diverse cultural representation,0.7
2024-03-13,emerging_topics,Digital hybrid experiences (physical venues with online streaming),0.7
2024-03-13,emerging_topics,"Free, participatory entertainment experiences becoming more accessible and mainstream",0.7
2024-03-13,emerging_topics,"Integration of fashion with other cultural domains (food, art) in museum exhibits",0.7
2024-03-13,emerging_topics,Night-time cultural programming emerging as distinct urban entertainment category,0.7
2024-03-13,emerging_topics,Increasing popularity of community-led and grassroots cultural preservation efforts,0.7
2024-03-13,emerging_topics,"Rise of free, accessible cultural programming in public spaces",0.7
2024-03-13,emerging_topics,"Emergence of sustainable urban recreation (kayaking, park activities)",0.7
2021-11-09,educational_demand,Sustainable urban development and green space design skills,0.7
2021-11-09,educational_demand,"Need for architecture and structural engineering expertise, particularly for skyscraper design and construction",0.7
2024-06-06,emerging_topics,Growing demand for visual/illustrated historical content vs traditional text-only formats,0.7
2021-11-09,educational_demand,Growing demand for technology startup skills and training in DUMBO area as it becomes a tech hub,0.7
2024-06-06,emerging_topics,Repurposing traditional transit services into leisure experiences,0.7
2024-06-06,emerging_topics,Mobile app-based ticketing and service access in public transportation,0.7
2024-06-06,emerging_topics,Secret/alternative dining venues and food discovery,0.7
2024-06-06,emerging_topics,Local expert-led specialized city tours and experiences,0.7
2024-06-06,emerging_topics,Authentic street food and ethnic cuisine experiences,0.7
2024-06-06,emerging_topics,Urban rooftop venues as alternative observation points - bypassing traditional observation decks,0.7
2024-06-06,emerging_topics,Historic venue preservation and adaptive reuse of industrial spaces,0.7
2024-06-06,emerging_topics,Rooftop and elevated experiences as alternatives to traditional observation decks,0.7
2024-06-06,emerging_topics,Water-based urban entertainment experiences,0.7
2024-06-06,emerging_topics,"Experiential tourism combining nature, art, and local culture",0.7
2024-06-06,emerging_topics,Digital-first visitor experience management through websites and online scheduling,0.7
2024-06-06,early_adopter_products,Little Island park's website for live music scheduling,0.7
2024-06-06,early_adopter_products,"The Escape Game attraction has 2,400+ Google reviews and a 5-star rating",0.7
2024-06-06,early_adopter_products,The Skylark rooftop bar is positioned as an alternative to traditional observation decks,0.7
2024-06-06,early_adopter_products,NYC Ferry app and service offering $2.75 rides is growing as an alternative transit option,0.7
2024-06-06,early_adopter_products,Timeout Market - food hall/market concept with rooftop bar,0.7
2024-06-06,early_adopter_products,Louis Vuitton digital trunk design interactive experience using workstations and physical design boxes,0.7
2024-06-06,early_adopter_products,The Edge outdoor observation deck offers 'City Climb' experience on building exterior,0.7
2024-06-06,early_adopter_products,QC Spa offers free birthday month access (normally $200 value) with one paying guest,0.7
2021-11-09,educational_demand,Cultural competency training demands due to high immigrant population,0.7
2021-11-09,educational_demand,Real estate/property management certification demands due to growing residential construction,0.7
2024-03-13,problem_spaces,Fake Uber scams at airports using iPads/signs to deceive travelers,0.7
2021-11-09,emerging_topics,"Rise of mixed-use urban developments combining residential, commercial, and recreational spaces",0.7
2024-03-13,problem_spaces,Limited contactless payment options for AirTrain requiring physical MetroCard,0.7
2024-03-13,behavioral_patterns,Physical infrastructure transitioning to contactless readers,0.7
2013-03-07,emerging_topics,Public spaces and urban greenery as essential components of livable cities,0.7
2013-03-07,emerging_topics,"Mixed-use urban development combining retail, culture, and residential",0.7
2013-03-07,emerging_topics,Arts and culture as economic drivers in urban centers,0.7
2013-03-07,emerging_topics,Integration of public art and cultural institutions in city planning,0.7
2013-03-07,emerging_topics,Urban open spaces and public areas as community assets,0.7
2024-03-13,behavioral_patterns,Growing behavior of passengers avoiding empty subway cars due to safety concerns,0.7
2024-03-13,behavioral_patterns,Behavioral adaptation to verify exact station/line combinations to avoid navigation errors,0.7
2024-03-13,behavioral_patterns,Tourist avoidance/abandonment of Omni unlimited passes when trips don't align with Monday-Sunday schedule,-0.7
2024-03-13,behavioral_patterns,Declining necessity of MetroCards (only needed for AirTrain),-0.7
2024-03-13,behavioral_patterns,Art gallery Thursday night hopping becoming popular social activity pattern,0.7
2024-03-13,behavioral_patterns,Growing expectation for quick ordering at fast-service establishments,0.7
2013-03-07,problem_spaces,Limited affordable housing due to continuous population growth,0.7
2013-03-07,problem_spaces,Space constraints in Manhattan leading to vertical development pressure,0.7
2013-03-07,problem_spaces,Tourism infrastructure capacity strain implied by references to major attractions and lifetime of activities,0.7
2024-03-13,behavioral_patterns,Walking preferred over taxis/rideshares during peak hours in Manhattan,0.7
2024-03-13,behavioral_patterns,Declining preference for Uber/taxi during peak hours (7:30am-8pm),-0.7
2024-03-13,behavioral_patterns,Increasing need to be aware of bike lanes due to cycling accidents surpassing car incidents,0.7
2024-03-13,behavioral_patterns,Rise in digital planning tools for coordinating free activities,0.7
2024-03-13,behavioral_patterns,Growing adoption of digital transit signs showing accurate arrival times,0.7
2024-03-13,behavioral_patterns,Taxi line avoidance behavior and unofficial solicitation continues to persist,0.7
2024-03-13,behavioral_patterns,"Growing preference for rideshare apps (Uber, Lyft, Revel) over traditional taxis, especially for family travel",0.7
2024-03-13,behavioral_patterns,Declining interest in shared shuttle services due to unpredictable travel times,-0.7
2022-03-22,behavioral_patterns,Using under-bed storage as primary storage solution in small spaces,0.7
2022-03-22,educational_demand,Professional flex wall installation certification/expertise,0.7
2022-03-22,educational_demand,Home office ergonomics and workspace optimization knowledge,0.7
2022-03-22,educational_demand,Storage solution expertise for urban living,0.7
2024-03-13,behavioral_patterns,Electricity costs showing consistent upward pattern with three planned increases through 2025,0.7
2024-03-13,behavioral_patterns,Cross-borough travel patterns adapting to avoid congestion zones while maintaining connectivity,0.7
2024-03-13,behavioral_patterns,Behavioral shift to overnight/off-peak travel to access pricing discounts,0.7
2024-03-13,behavioral_patterns,Shift toward digital payment systems (EasyPass) with 10% penalty for non-users,0.7
2024-03-13,behavioral_patterns,Increasing use of mobile phone-based transit tickets and payments,0.7
2024-03-13,behavioral_patterns,Rising subway fare evasion through emergency exits and 'back cocking',0.7
2024-03-13,behavioral_patterns,Growing preference for official ticket websites over reseller platforms,0.7
2024-03-13,behavioral_patterns,Growing consumer resistance to tipping for self-service/counter service,0.7
2024-03-13,behavioral_patterns,Shift from traditional tourist areas to local neighborhood exploration,0.7
2024-03-13,behavioral_patterns,Declining use of JFK airport SIM card kiosks,-0.7
2024-03-13,behavioral_patterns,Increasing use of mobile apps/websites vs traditional ticket booth lines,0.7
2024-03-13,behavioral_patterns,Increasing use of MTA Train Time app for ticket purchases and planning,0.7
2024-03-13,behavioral_patterns,Declining preference for subway travel from airport to Manhattan,-0.7
2024-03-13,behavioral_patterns,Growing preference for advance online signup systems for free activities,0.7
2024-03-13,behavioral_patterns,Migration to outdoor/open-air cultural events like Lincoln Center summer series,0.7
2022-11-28,educational_demand,Increasing value of presentation and garnishing techniques,0.7
2024-06-06,behavioral_patterns,Price sensitivity increasing even among luxury brand consumers,0.7
2024-06-06,behavioral_patterns,Growing preference for insider 'secret' restaurant locations to avoid crowds,0.7
2024-06-06,behavioral_patterns,Mobile app adoption for ferry ticketing replacing physical tickets,0.7
2022-11-28,problem_spaces,Cocktail bars need balanced focus between drinks quality and ambiance,0.7
2022-11-28,problem_spaces,High cost barrier for quality cocktail experiences compared to regular bars,0.7
2024-06-06,behavioral_patterns,Physical bookstores evolving into cultural brand destinations beyond just book sales,0.7
2024-06-06,behavioral_patterns,"Rising cost of living ($4,825 for 1-bedroom) affecting neighborhood demographics",0.7
2024-06-06,behavioral_patterns,Consumer behavior trending toward multi-vendor food halls over traditional restaurants,0.7
2024-06-06,behavioral_patterns,Growing popularity of rooftop bars with dual-purpose value (views + happy hour deals),0.7
2024-06-06,behavioral_patterns,Consumer behavior trending toward seeking luxury experiences without luxury pricing,0.7
2024-03-13,behavioral_patterns,Midnight moment digital art viewing from 11:57-12:00 shows increasing appeal for late-night alternative tourism,0.7
2022-11-28,behavioral_patterns,Equal emphasis on atmosphere and drink quality becoming standard expectation,0.7
2022-11-28,behavioral_patterns,Growing preference for cocktail bars that balance atmosphere and drink quality equally (50-50 split),0.7
2022-11-28,behavioral_patterns,Movement toward advance reservations (1 week out) for popular cocktail venues,0.7
2022-11-28,behavioral_patterns,Growing consumer willingness to pay premium prices for crafted cocktails over basic mixed drinks,0.7
2024-06-06,behavioral_patterns,Growing preference for 'pay what you wish' museum pricing models among local residents,0.7
2024-06-06,behavioral_patterns,Shift from traditional transit to scenic tram rides for cost-conscious travelers ($2.75),0.7
2022-11-28,educational_demand,Need for hospitality staff trained in upscale/luxury service standards,0.7
2022-11-28,educational_demand,Growing need for Japanese cocktail culture and technique training,0.7
2024-06-06,behavioral_patterns,Combining entertainment activities (shows) with experiential dining/drinks to maximize value,0.7
2022-11-28,emerging_topics,Reservation-required exclusive bar experiences,0.7
