date,category,information,score
2024-03-13,problem_spaces,Rising cost differential between ride-hailing ($30-40) vs subway ($2),0.6
2024-03-13,problem_spaces,Local businesses struggling against chain establishments for tourist attention,0.6
2024-03-13,emerging_topics,Mobile-first transit navigation and timing,0.6
2024-03-13,emerging_topics,Real-time transit monitoring and tracking systems,0.6
2024-03-13,emerging_topics,Alternative transportation and micro-mobility awareness,0.6
2024-03-13,problem_spaces,Preservation of historic spaces and community gardens faces ongoing development pressure,0.6
2024-03-13,problem_spaces,Limited space and high demand for popular free events requires very early arrival to secure spots,0.6
2024-03-13,problem_spaces,Need for better promotion of alternative tourist routes like Manhattan Bridge vs Brooklyn Bridge,0.6
2024-03-13,problem_spaces,Long compliance timeline needed (until Nov 2024) indicates significant operational challenges for restaurants adapting to new regulations,0.6
2024-03-13,problem_spaces,Location accessibility issues for outer borough restaurants expanding to Manhattan,0.6
2024-03-13,problem_spaces,Cost barriers with multiple attraction add-on fees (like $25 extra for The Beam experience),0.6
2024-03-13,problem_spaces,Phone usage during Broadway shows causing disruption and conflict,0.6
2024-03-13,emerging_topics,Urban mobility pricing optimization,0.6
2024-03-13,emerging_topics,Transformation of corporate/institutional spaces into public gathering areas,0.6
2024-06-06,early_adopter_products,Aire Ancient Baths spa offers Roman-style thermal baths and wine baths,0.6
2024-06-06,early_adopter_products,Canal Street Market emerging as a curated retail/dining destination,0.6
2024-06-06,early_adopter_products,Los Tacos No. 1 - Restaurant expanding with multiple NYC locations,0.6
2024-03-13,educational_demand,Rising importance of digital literacy skills for managing mobile tickets and apps,0.6
2024-03-13,educational_demand,Skills needed for budget travel and finding cost-effective entertainment options,0.6
2024-03-13,educational_demand,Increasing need for theater staff training on late seating and mobile device policies,0.6
2024-03-13,educational_demand,Knowledge gap in minimum wage and tipping regulations compliance,0.6
2024-03-13,educational_demand,Rising need for understanding digital payment systems and mobile apps for public transit,0.6
2024-03-13,educational_demand,Skill requirements for new toll collection technology implementation,0.6
2024-03-13,educational_demand,Educational needs around transit payment modernization,0.6
2024-03-13,problem_spaces,Tourist/visitor accessibility issues with transit payment systems (OMNI limitations),0.6
2024-03-13,problem_spaces,Need for better physical barriers (plexiglass) to prevent turnstile jumping,0.6
2024-03-13,problem_spaces,Low base wages for service workers creating dependency on tips,0.6
2024-03-13,problem_spaces,Rush ticket policies often separate groups/pairs due to limited availability,0.6
2024-03-13,problem_spaces,Limited luggage storage space in train end cars causes passenger difficulties,0.6
2024-03-13,problem_spaces,"Crowding issues on subway trains, especially in front cars",0.6
2024-03-13,behavioral_patterns,Rise in advance booking behavior for premium experiences like Statue of Liberty crown access,0.6
2024-03-13,behavioral_patterns,Evolution of observation decks from simple viewpoints to multi-experience venues,0.6
2024-06-06,early_adopter_products,NYC Ferry system being promoted as affordable transit option,0.6
2024-06-06,early_adopter_products,Citibike has partnership with Lyft for free first rides through promo codes,0.6
2024-03-13,behavioral_patterns,"Growth in free, self-guided tourism alternatives to traditional paid attractions",0.6
2024-06-06,early_adopter_products,Culture Lab LIC provides free art galleries and live music performances,0.6
2024-06-06,early_adopter_products,Rooftop bars repurposed from old warehouses,0.6
2024-06-06,early_adopter_products,Mobile payment apps for transit tickets showing increased adoption,0.6
2024-06-06,early_adopter_products,Trinity Church - historic site recently reopened after years of closure,0.6
2024-06-06,early_adopter_products,Hot tub boat tours starting at $449/person for NYC water views,0.6
2024-03-13,emerging_topics,Global city competitiveness in cost of living metrics,0.6
2024-03-13,emerging_topics,Multi-year staged utility rate increases becoming norm,0.6
2024-03-13,emerging_topics,Digital infrastructure for automated toll/fee collection,0.6
2024-03-13,emerging_topics,Regional governance tensions over urban mobility policies,0.6
2024-03-13,educational_demand,Cultural sensitivity and local customs education,0.6
2024-03-13,educational_demand,Gap in public transit system navigation skills and route planning,0.6
2024-03-13,educational_demand,Education needed on local ID requirements and alcohol purchase regulations,0.6
2024-03-13,educational_demand,Learning requirement for Fair Capping system rules and timing restrictions,0.6
2024-03-13,educational_demand,Requirement to learn subway system nomenclature and station disambiguation,0.6
2024-03-13,educational_demand,Education needed on subway transfer protocols and station identification,0.6
2024-03-13,educational_demand,Learning requirements for understanding complex city addressing systems (E/W designations),0.6
2024-06-06,early_adopter_products,Summit observation deck has improved crowd management and interactive features,0.6
2024-06-06,early_adopter_products,Bryant Park automated sports equipment rental system for ping pong and other games,0.6
2024-03-13,behavioral_patterns,Migration of food destinations from outer boroughs to central locations changing customer travel patterns,0.6
2024-03-13,behavioral_patterns,Shift toward experiential and immersive theatrical productions,0.6
2024-03-13,educational_demand,Rising demand for multilingual tour guides for international tourists,0.6
2024-03-13,emerging_topics,Increasing importance of digital payment systems in transit,0.6
2024-03-13,behavioral_patterns,Rising trend of passengers using indication boards to locate conductor cars for safety at night,0.6
2024-03-13,behavioral_patterns,Declining need to check phones for train arrival times due to station board implementations,-0.6
2024-03-13,behavioral_patterns,Rising use of electric vehicle options (Revel) despite longer wait times,0.6
2024-03-13,behavioral_patterns,Increasing preference for digital payment methods in taxis (mandatory credit card readers),0.6
2024-03-13,behavioral_patterns,Growing adoption of Long Island Railroad (LIRR) as preferred airport transport option,0.6
2024-03-13,behavioral_patterns,Rising adoption of free airport WiFi instead of purchasing airport SIM cards,0.6
2024-03-13,behavioral_patterns,Decreasing reliance on physical ticket windows in favor of digital options,0.6
2024-03-13,behavioral_patterns,Strict enforcement against phone usage and photography during shows,0.6
2024-03-13,behavioral_patterns,Rising consumer awareness and avoidance of double-tipping practices,0.6
2024-03-13,behavioral_patterns,Growing anti-tipping sentiment and membership in groups like 'end tipping' on Reddit,0.6
2024-03-13,behavioral_patterns,Mechanical modification of turnstiles to prevent fare evasion techniques,0.6
2024-03-13,behavioral_patterns,Tourist usage of OMNI unlimited rides becoming more viable/practical,0.6
2024-03-13,behavioral_patterns,Monthly utility bill adjustments becoming more frequent occurrence,0.6
2024-03-13,educational_demand,Growing need for local tourism guide certification/training,0.6
2024-03-13,educational_demand,Rising demand for performing arts education and live concert exposure through Juilliard programs,0.6
2024-03-13,educational_demand,Need for tourism/hospitality knowledge about less-known NYC attractions,0.6
2024-03-13,educational_demand,Increasing demand for cultural preservation and historical education specialists,0.6
2024-03-13,emerging_topics,Contactless/automated transit payment systems,0.6
2024-03-13,emerging_topics,Growing emphasis on precise location data/addressing,0.6
2024-03-13,behavioral_patterns,Traditional cultural institutions adding interactive and social media-friendly elements,0.6
2024-03-13,emerging_topics,User experience optimization for airport-to-city connections,0.6
2024-03-13,behavioral_patterns,Growing interest in alternative bridge routes (Manhattan vs Brooklyn) for photography and views,0.6
2024-03-13,behavioral_patterns,Shift toward self-guided digital walking tours using online resources,0.6
2024-03-13,behavioral_patterns,Increased demand for local-guided authentic experiences (Big Apple Greeter),0.6
2024-03-13,behavioral_patterns,Growing preference for early arrival behavior to secure spots at free events,0.6
2024-03-13,behavioral_patterns,"Growing preference for local/small businesses over chains, especially for coffee/food",0.6
2024-03-13,behavioral_patterns,Growing reliance on subway for intra-Manhattan commutes due to speed/cost benefits,0.6
2024-03-13,behavioral_patterns,Pre-walking behavior on crowded subway trains becoming common practice,0.6
2024-03-13,behavioral_patterns,Modified dining behaviors to accommodate high-turnover restaurants,0.6
2024-03-13,behavioral_patterns,Adoption of fare capping system replacing traditional unlimited passes,0.6
2024-03-13,behavioral_patterns,Increasing specificity in station meeting arrangements (specifying line/corner vs just station name),0.6
2024-03-13,emerging_topics,Public transportation pricing pressure and revenue challenges,0.6
2024-03-13,emerging_topics,Digital payment and mobile ordering systems in public transportation,0.6
2024-03-13,emerging_topics,Movement toward guaranteed minimum wages for gig workers,0.6
2024-03-13,emerging_topics,Tension between American tipping culture and international visitor expectations,0.6
2024-03-13,emerging_topics,Mobile connectivity and free public WiFi becoming essential infrastructure,0.6
2024-03-13,emerging_topics,Digital lottery systems replacing traditional in-person ticket queuing,0.6
2024-03-13,emerging_topics,Physical ticket vending machines,-0.6
2024-03-13,emerging_topics,Cultural preservation and heritage tourism,0.6
2024-06-06,emerging_topics,Borough/neighborhood exploration tourism,0.6
2024-03-13,emerging_topics,Integration of digital/tech with traditional cultural institutions,0.6
2024-03-22,educational_demand,Career transition from management consulting to content creation,0.6
2022-03-22,emerging_topics,Climate comfort solutions for home offices,0.6
2022-03-22,emerging_topics,Budget-friendly DIY decor solutions (like repurposing basic materials),0.6
2022-03-22,emerging_topics,"In-unit amenities (laundry, dishwasher) as urban luxury differentiators",0.6
2022-03-22,early_adopter_products,Faux plants as maintenance-free decor alternatives,0.6
2022-03-22,early_adopter_products,Dishwasher becoming a premium amenity in NYC apartments,0.6
2024-03-22,educational_demand,Brand deal negotiation and contract management abilities,0.6
2024-03-22,behavioral_patterns,Spontaneous social networking becoming integrated with content creation,0.6
2024-06-06,educational_demand,Rising interest in wellness/spa service training for unique experiences like wine baths and thermal pools,0.6
2024-03-22,problem_spaces,Difficulty breaking free from frugal mentality even when spending on essential work equipment,0.6
2024-03-22,emerging_topics,Technology as productivity enabler,0.6
2024-03-22,emerging_topics,Spontaneous lifestyle and work-life integration,0.6
2024-03-22,emerging_topics,Urban social serendipity and community connection,0.6
2024-06-06,educational_demand,Market demand for budget-conscious theater ticket purchasing skills and knowledge,0.6
2024-06-06,educational_demand,Growing demand for specialty coffee barista training and global coffee knowledge,0.6
2024-06-06,problem_spaces,Limited payment options requiring cash deposits for recreational activities,0.6
2024-03-13,emerging_topics,Art gallery experiences evolving to include social/community elements,0.6
2022-03-22,emerging_topics,Privacy solutions for modern glass architecture,0.6
2022-03-22,problem_spaces,Legal/permit complexities around installing flex walls in NYC apartments,0.6
2022-03-22,problem_spaces,Need for dual workspace setup to separate work and personal activities,0.6
2022-03-22,problem_spaces,Privacy concerns with large windows in urban residential buildings,0.6
2022-03-22,problem_spaces,Difficulty creating cozy/homey feel in minimal urban apartments,0.6
2022-03-22,behavioral_patterns,Rising preference for in-unit laundry as a key amenity in NYC apartments,0.6
2022-03-22,behavioral_patterns,Trend toward maximizing vertical storage space in small apartments,0.6
2021-11-09,early_adopter_products,High Line park (created 2009),0.6
2021-11-09,early_adopter_products,Bubble tea establishments expanding in Chinatown,0.6
2021-11-09,early_adopter_products,Central Park as filming location,0.6
2023-12-21,educational_demand,"Tour guide certification needs for specialized areas (architecture, history)",0.6
2023-12-21,educational_demand,Urban navigation and transportation system knowledge requirements,0.6
2023-12-21,behavioral_patterns,"Transition of industrial spaces into public recreation areas (High Line, Domino Park)",0.6
2023-12-21,behavioral_patterns,"Evolution of historic areas (Chelsea Market, Meatpacking) into mixed retail/dining destinations",0.6
2023-12-21,problem_spaces,Navigation challenges in complex neighborhood layouts and street systems,0.6
2024-06-06,educational_demand,Increasing opportunities for tour guide certification and local history knowledge,0.6
2024-06-06,educational_demand,Rising opportunity for free public education programs and skill-building classes,0.6
2023-12-21,problem_spaces,Cold winter temperatures limit outdoor activities and tourist comfort,0.6
2021-11-09,emerging_topics,Growing importance of university student activism around labor rights and immigration,0.6
2021-11-09,emerging_topics,Grid-based urban planning for walkability and navigation,0.6
2021-11-09,emerging_topics,Gentrification of historically disadvantaged neighborhoods,0.6
2021-11-09,emerging_topics,Car-free urban lifestyle adoption,0.6
2021-11-09,emerging_topics,Global financial center competition,0.6
2021-11-09,emerging_topics,Work-driven migration to economic centers,0.6
2021-11-09,emerging_topics,Increasing focus on architectural design that incorporates public spaces,0.6
2021-11-09,emerging_topics,Gentrification changing traditional cultural neighborhoods,0.6
2024-06-06,problem_spaces,Preservation challenges for historic family-owned businesses in Midtown Manhattan,0.6
2021-11-09,emerging_topics,Urban social disconnect and tech-enabled isolation,0.6
2021-11-09,emerging_topics,Public spaces as cultural/entertainment venues,0.6
2021-11-09,emerging_topics,Urban parking challenges in dense cities,0.6
2021-11-09,emerging_topics,Platform screen doors as safety infrastructure,0.6
2021-11-09,emerging_topics,Urban sustainability and climate change awareness in city planning,0.6
2021-11-09,emerging_topics,Local food authenticity in globalized cities,0.6
2024-06-06,problem_spaces,"Time Square area is very noisy/chaotic, lacking quiet spaces",0.6
2024-06-06,problem_spaces,Theater show timing coordination with dinner reservations requires careful advance planning,0.6
2024-06-06,problem_spaces,"High food prices ($20 bagel with lox, $25 sandwiches) at iconic establishments",0.6
2024-06-06,problem_spaces,"Food tours often provide inadequate portion sizes, frustrating customers",0.6
2024-06-06,problem_spaces,"Advance planning required for free show tickets and activities, limiting spontaneity",0.6
2024-06-06,problem_spaces,Limited awareness of free public programs/classes among tourists and residents,0.6
2024-06-06,problem_spaces,Inconsistent pickup times (ranging from 2-13 minutes) affecting service reliability,0.6
2024-06-06,problem_spaces,Museum admission costs ($25 for MoMA) create accessibility barriers for visitors,0.6
2024-06-06,problem_spaces,Limited transportation options in Greenpoint Brooklyn make it inconvenient to access,0.6
2024-06-06,problem_spaces,Peak tourist areas becoming overcrowded while local gems remain undiscovered,0.6
2024-06-06,problem_spaces,Limited shade and amenities at Coney Island beach creates comfort/safety issues,0.6
2024-06-06,problem_spaces,Poor crowd management and maintenance issues at tourist attractions impact experience quality,0.6
2024-06-06,problem_spaces,"High-end development has displaced historical public service facilities on Roosevelt Island, affecting housing affordability",0.6
2024-06-06,problem_spaces,Transportation costs add up even for short trips across boroughs,0.6
2024-06-06,problem_spaces,Crowding at major tourist sites affects visitor experience,0.6
2024-06-06,problem_spaces,Limited budget constraints forcing trade-offs between entertainment options,0.6
2024-06-06,problem_spaces,Difficulty getting reservations at exclusive restaurants like Chef's Table,0.6
2023-12-21,problem_spaces,Advanced tickets required for popular attractions like Statue of Liberty crown access causes planning friction,0.6
2023-12-21,emerging_topics,Adaptive reuse of industrial spaces for retail and entertainment,0.6
2021-11-09,emerging_topics,Transformation of industrial areas into arts/culture districts,0.6
2013-03-07,emerging_topics,Heritage preservation balanced with modern development,0.6
2024-06-06,behavioral_patterns,Strategic combining of dining and entertainment experiences to maximize budget,0.6
2024-06-06,behavioral_patterns,Shift in neighborhood character from warehouses to upscale boutique destinations,0.6
2024-06-06,behavioral_patterns,Interactive elements (DIY trunk design) becoming expected part of luxury brand experiences,0.6
2024-06-06,behavioral_patterns,Rising popularity of budget-friendly authentic Asian fast-casual dining under $7-8,0.6
2024-06-06,behavioral_patterns,Avoidance of chain restaurants (like Pizza Hut) in favor of local establishments,0.6
2024-06-06,behavioral_patterns,Preference for individual pizza slices over full pies for budget dining,0.6
2013-03-07,emerging_topics,Memorial spaces and collective memory in urban planning,0.6
2024-06-06,behavioral_patterns,Growing trend of visitors staying in outer boroughs to save money while maintaining easy Manhattan access,0.6
2013-03-07,emerging_topics,Adaptive reuse of historic architecture,0.6
2013-03-07,emerging_topics,Cultural heritage preservation in rapidly changing urban areas,0.6
2024-06-06,behavioral_patterns,"Shift in visitor preferences from large group tours to more intimate, luxury experiences",0.6
2024-06-06,behavioral_patterns,"Increasing importance of verifying business hours by phone before visiting, especially for popular establishments",0.6
2013-03-07,problem_spaces,Language barriers with 800+ language groups affecting communication,0.6
2013-03-07,problem_spaces,High retail costs and commercial rent pressures on small businesses,0.6
2024-06-06,behavioral_patterns,Migration from 2019 to updated neighborhood guide content shows evolving visitor needs,0.6
2024-06-06,behavioral_patterns,Shift toward advance reservation requirements for entertainment venues,0.6
2024-06-06,behavioral_patterns,Budget book shopping behavior shifting to outdoor displays/used books,0.6
2024-06-06,behavioral_patterns,Social media influence driving store visibility (Bella Hadid reference),0.6
2024-06-06,behavioral_patterns,Increasing use of social media food recommendations for hidden/alternative venues,0.6
2024-06-06,behavioral_patterns,Growing demand for authentic local food spots versus tourist traps,0.6
2024-06-06,behavioral_patterns,Using TKTS booth for accessing discounted Broadway tickets rather than full price,0.6
2024-06-06,behavioral_patterns,Strategic budgeting and real-time cost tracking during tourism activities,0.6
2024-06-06,behavioral_patterns,Increasing use of mobile apps for self-guided tours and navigation (e.g. Highline app),0.6
2024-06-06,behavioral_patterns,"Movement away from spontaneous visits toward pre-planned, app-guided experiences",0.6
2024-06-06,behavioral_patterns,"Rising interest in water-based activities like sailing tours with added luxury elements (champagne, guided experiences)",0.6
2022-03-22,educational_demand,Flexible wall construction knowledge,0.6
2022-03-22,educational_demand,Room layout and design principles for dual-purpose workspaces,0.6
2022-03-22,educational_demand,NYC building code and permit regulations knowledge,0.6
2024-06-06,behavioral_patterns,Transition toward guided experiences and curated itineraries for city exploration,0.6
2022-03-22,behavioral_patterns,Transitioning from free/basic office furniture to intentionally purchased ergonomic seating,0.6
2022-03-22,behavioral_patterns,Growing preference for storage-optimized closet systems with hanging shelves,0.6
2013-03-07,problem_spaces,Environmental sustainability challenges in dense urban environment,0.6
2024-06-06,behavioral_patterns,"Growing preference for public spaces and free activities (parks, libraries, community classes) over paid attractions",0.6
2023-12-21,emerging_topics,Observation platforms and elevated experiences as tourism drivers,0.6
2022-11-28,behavioral_patterns,Integration of Japanese-style service elements and specialized equipment (highball machines) in NYC bars,0.6
2022-11-28,emerging_topics,Hybrid concepts combining casual and upscale elements,0.6
2022-11-28,emerging_topics,Elevated bar food programs beyond basic snacks,0.6
2022-11-28,problem_spaces,Limited space and crowding issues at rooftop bars requiring guests to take turns for photos,0.6
2022-11-28,problem_spaces,Challenge of maintaining both high-quality drinks and views/ambiance in rooftop venues,0.6
2022-11-28,behavioral_patterns,New York maintaining/strengthening position as global nightlife destination,0.6
2022-11-28,behavioral_patterns,Increasing demand for cocktail bars that offer high-end food pairings beyond basic bar snacks,0.6
2022-11-28,behavioral_patterns,Trend toward multi-room concepts with different vibes/experiences within same venue,0.6
2024-06-06,behavioral_patterns,Rising popularity of alternative neighborhoods like Long Island City and Greenpoint as cheaper alternatives to Manhattan,0.6
2022-11-28,educational_demand,Skills gap in specialty cocktail preparation and mixology,0.6
2022-11-28,educational_demand,Increasing importance of food pairing knowledge for cocktail professionals,0.6
2022-11-28,educational_demand,Growing importance of cultural knowledge and international beverage traditions,0.6
2022-11-28,educational_demand,Need for understanding of premium ingredients and their applications,0.6
2023-12-21,early_adopter_products,Ride-sharing services (generic mention),0.6
2023-12-21,early_adopter_products,Hudson Yards mixed-use development complex,0.6
2022-11-28,emerging_topics,Focus on precision crafted drinks over traditional simple cocktails,0.6
2022-11-28,emerging_topics,High-end nightlife in financial districts,0.6
2022-11-28,early_adopter_products,Japanese-style highballs and Tokyo-inspired bars trending in NYC,0.6
2022-11-28,early_adopter_products,Edible ink printing on rice paper for cocktail garnishes,0.6
2022-11-28,early_adopter_products,Katana Kitten ranked #9 on World's Best Bars list,0.6
2024-06-06,behavioral_patterns,Growing preference for consolidated/efficient sightseeing tours vs individual visits,0.6
2024-06-06,behavioral_patterns,Growing importance of mobile-friendly restaurant locations with multiple branches,0.6
2024-06-06,behavioral_patterns,Increasing importance of pre-show dining reservations and timing coordination,0.6
2024-06-06,behavioral_patterns,Rising trend of next-day lottery ticket entries becoming standard practice for Broadway shows,0.6
2024-06-06,behavioral_patterns,Growing importance of reservation requirements for speakeasy bars and exclusive venues,0.6
2024-06-06,behavioral_patterns,Combining transportation and leisure activities (ferry + bar) for efficiency,0.6
2024-06-06,behavioral_patterns,"Increasing demand for consolidated, time-efficient tourism experiences (3-hour comprehensive food tours)",0.6
2013-03-07,behavioral_patterns,"Growing trend of cross-borough exploration, particularly to Brooklyn",0.6
2024-06-06,behavioral_patterns,Increasing use of advance reservations and planning for free activities/experiences,0.6
2024-06-06,behavioral_patterns,"Rising interest in free community activities in public spaces (juggling, fencing, yoga)",0.6
2024-06-06,behavioral_patterns,Shift from walk-in dining to app-based restaurant booking for discounts,0.6
2024-06-06,behavioral_patterns,Migration of gift card usage to mobile apps for additional point accumulation,0.6
2021-11-09,emerging_topics,Neighborhood-specific cultural preservation amid gentrification,0.6
2021-11-09,emerging_topics,Public marijuana use normalization in cities,0.6
2021-11-09,emerging_topics,Urban safety disparity between day and night activities,0.6
2024-06-06,emerging_topics,Growing appeal of artist/creative districts for tourism and cultural experiences,0.6
2021-11-09,educational_demand,Hospitality/food service skills development for growing Asian restaurant market,0.6
2021-11-09,educational_demand,Cultural competency training opportunities for businesses serving Asian communities,0.6
2021-11-09,educational_demand,Increasing demand for cultural competency training to serve diverse ethnic communities,0.6
2021-11-09,educational_demand,Growing requirement for hospitality and tourism management skills in NYC,0.6
2021-11-09,educational_demand,Public infrastructure project management capabilities,0.6
2021-11-09,educational_demand,Environmental management skills needed to address waste collection and urban cleanliness challenges,0.6
