date,category,information,score
2022-03-22,emerging_topics,Regulatory adaptation to flexible living arrangements in cities,0.5
2022-03-22,early_adopter_products,Window privacy through reflective glass technology,0.5
2022-03-22,early_adopter_products,Hanging shelving systems for closet organization,0.5
2021-11-09,emerging_topics,Digital advertising and billboard evolution,0.5
2021-11-09,emerging_topics,Asian immigrant communities driving urban economic success through education,0.5
2024-03-13,emerging_topics,Borough-specific food destinations becoming citywide attractions,0.5
2021-11-09,emerging_topics,Infrastructure maintenance and liability prevention measures,0.5
2021-11-09,emerging_topics,24/7 public transit infrastructure,0.5
2021-11-09,emerging_topics,Architectural fusion of art and transportation hubs,0.5
2021-11-09,emerging_topics,Urban resilience and post-disaster rebuilding,0.5
2021-11-09,emerging_topics,Experiential entertainment and nightlife experiences,0.5
2021-11-09,emerging_topics,Integration of historical elements into modern urban design,0.5
2024-09-09,emerging_topics,"Urban quality of life challenges (infrastructure, public transit)",0.5
2024-09-09,problem_spaces,Work-life-study balance challenges for graduate students,0.5
2024-09-09,behavioral_patterns,International school education as preferred English learning pathway,0.5
2022-03-22,early_adopter_products,Storage ottomans from Amazon (140lb capacity) as multifunctional furniture,0.5
2021-11-09,problem_spaces,Car ownership challenges due to costs and logistics,0.5
2021-11-09,problem_spaces,Aging infrastructure of older observation decks requires ongoing maintenance,0.5
2024-03-13,emerging_topics,Guided specialized tours with local experts,0.5
2024-03-13,emerging_topics,Revival and adaptation of classic works for contemporary audiences,0.5
2023-12-21,educational_demand,Environmental sustainability education for urban parks and green spaces,0.5
2024-03-13,emerging_topics,Multi-modal transit pricing integration and optimization,0.5
2021-11-09,early_adopter_products,New York Stock Exchange (NYSE) trading platform,0.5
2021-11-09,early_adopter_products,"Wall Street stock exchanges (NYSE, NASDAQ)",0.5
2021-11-09,early_adopter_products,Illegal ATVs/dirt bikes (law enforcement crackdown),-0.5
2021-11-09,early_adopter_products,Columbia University education,0.5
2021-11-09,early_adopter_products,One World Trade Center observatory - newest/highest observation point in NYC,0.5
2021-11-09,early_adopter_products,Chelsea Market - historic Oreo factory converted to food hall,0.5
2021-11-09,early_adopter_products,Chelsea Market - historic food hall and former Oreo factory location,0.5
2021-11-09,early_adopter_products,Manhattan garbage collection infrastructure,-0.5
2021-11-09,early_adopter_products,New York City Subway - largest 24/7 rapid transit system in Western hemisphere,0.5
2021-11-09,early_adopter_products,High Line elevated greenway park (repurposed railway),0.5
2021-11-09,early_adopter_products,One World Trade Center (formerly Freedom Tower) - tallest US skyscraper,0.5
2024-03-13,emerging_topics,Borough-specific real estate demand patterns evolving,0.5
2024-03-13,emerging_topics,Fare evasion prevention through infrastructure redesign,0.5
2024-03-13,emerging_topics,Public-private partnerships in cultural programming and urban entertainment,0.5
2024-03-13,emerging_topics,Traditional tipping norms being disrupted by digital payment systems,0.5
2024-03-13,emerging_topics,Digital ticket scams and fraud becoming more sophisticated,0.5
2024-03-13,emerging_topics,Demand for simplified pricing and fare structures in public transit,0.5
2024-03-13,emerging_topics,Shift away from shared shuttle services to direct transport,-0.5
2024-03-13,emerging_topics,Dynamic/surge pricing becoming standard in urban transport,0.5
2021-11-09,early_adopter_products,Metropolitan Museum of Art (Met) - most visited US museum,0.5
2024-03-13,emerging_topics,Noise cancellation technology for urban environments,0.5
2024-03-13,emerging_topics,Digital ID verification for age-restricted purchases,0.5
2024-03-13,emerging_topics,Urban noise pollution management,0.5
2024-03-13,emerging_topics,Traditional mass transit efficiency in dense cities,0.5
2024-03-13,emerging_topics,Hidden/non-traditional historical attractions,0.5
2024-03-13,emerging_topics,Urban nature and wildlife experiences,0.5
2024-09-09,educational_demand,Need for cultural/lifestyle adaptation support for international students,0.5
2024-06-15,early_adopter_products,Subway system/public transit in NYC,0.5
2024-06-15,early_adopter_products,Gentle Monster eyewear store,0.5
2024-03-13,early_adopter_products,Digital/online viewing of hip-hop performances and breakdancing sessions,0.5
2024-03-13,early_adopter_products,Metro Card not compatible with NYC Ferry system,-0.5
2024-03-13,early_adopter_products,Broadway ticketing sites and official box office websites are competing channels for ticket sales,0.5
2024-03-13,early_adopter_products,Amazon is being used as a recommended platform to purchase US SIM cards before travel,0.5
2024-03-13,early_adopter_products,Physical MetroCard system,-0.5
2024-03-13,early_adopter_products,"Uber, Lyft, and Revel are the main rideshare options at JFK airport",0.5
2024-03-13,early_adopter_products,Dynamic pricing based on time windows (4-8pm weekdays),0.5
2024-03-13,early_adopter_products,Soundcore Liberty 4 NC earbuds by Anchor featuring 98.5% noise reduction for subway use,0.5
2024-03-13,early_adopter_products,Big App platform matches tourists with local New Yorkers,0.5
2024-03-13,early_adopter_products,Bushwick Collective (street art installation),0.5
2024-03-13,early_adopter_products,Galleries Now (galleries-now.net) website for finding art gallery openings,0.5
2024-03-13,early_adopter_products,SNL (Saturday Night Live) maintains high demand for live audience seats,0.5
2024-03-13,early_adopter_products,The Tonight Show with Jimmy Fallon continues as a major TV audience draw,0.5
2024-03-13,early_adopter_products,Summit One Vanderbilt - trending observation deck with indoor/outdoor features,0.5
2021-11-09,problem_spaces,Weather dependency limits observation deck experiences (foggy conditions prevented Edge visit),0.5
2024-03-22,early_adopter_products,iPhone/smartphone used for content creation/vlogging (implied by video style),0.5
2024-03-22,educational_demand,Self-employment/freelance business management skills,0.5
2024-03-22,behavioral_patterns,Adapting living space and routines to support content creation workflow,0.5
2021-11-09,educational_demand,Financial/stock trading education demand given NYSE's prominence,0.5
2021-11-09,educational_demand,Tour guide expertise demand for cultural/historical sites,0.5
2021-11-09,educational_demand,Urban real estate/property management knowledge requirements,0.5
2021-11-09,educational_demand,Growing demand for multilingual service staff in Chinatown/Little Italy areas,0.5
2021-11-09,educational_demand,Rooftop bar safety and service certifications needed due to increasing popularity,0.5
2021-11-09,educational_demand,"Urban development and real estate expertise requirements, particularly for luxury and high-end markets",0.5
2021-11-09,educational_demand,Demand for modern contactless payment systems training,0.5
2021-11-09,educational_demand,Transportation and logistics training requirements near JFK/LaGuardia airports,0.5
2021-11-09,educational_demand,Need for urban redevelopment and warehouse repurposing expertise in Williamsburg,0.5
2024-03-13,early_adopter_products,OMNI card payment system expanding flexibility,0.5
2021-11-09,behavioral_patterns,Wealthy international buyers creating culturally distinct neighborhood enclaves,0.5
2021-11-09,behavioral_patterns,Foreign-born population growth continuing to shape city demographics,0.5
2021-11-09,behavioral_patterns,Migration pattern showing preference for culturally familiar environments and services,0.5
2021-11-09,problem_spaces,Widespread scaffolding installations for liability protection rather than actual construction,0.5
2021-11-09,problem_spaces,Road quality issues - NYC roads described as 'far from worse than rest of US',0.5
2021-11-09,problem_spaces,Cost overruns on infrastructure (Oculus $3.9B vs $2B budget),0.5
2021-11-09,problem_spaces,Confusing metro card system,-0.5
2021-11-09,problem_spaces,Museums failing to meet visitor expectations for historical content - misaligned exhibits,0.5
2024-06-15,emerging_topics,Public transportation adoption among younger generations,0.5
2021-11-09,problem_spaces,"Aging infrastructure maintenance (e.g., 100-year-old carousel needing restoration)",0.5
2024-06-15,problem_spaces,Cold weather preparedness issues for travelers from warm climates,0.5
2021-11-09,problem_spaces,Cultural isolation/dependency - Asian residents clustering due to needing familiar services/amenities,0.5
2021-11-09,problem_spaces,Foreign real estate investment changing neighborhood character,0.5
2024-06-15,behavioral_patterns,Adaptation to cold weather through shopping/clothing changes,0.5
2024-06-15,behavioral_patterns,Emerging preference for Japanese beauty services/experiences,0.5
2024-06-15,educational_demand,Cultural adaptation and city lifestyle acclimation,0.5
2024-06-15,educational_demand,Weather preparation and travel planning competency,0.5
2021-11-09,behavioral_patterns,Grid-based street navigation system adoption and usage,0.5
2021-11-09,behavioral_patterns,Sustained migration to NYC for career advancement in finance/tech sectors,0.5
2021-11-09,behavioral_patterns,Shift toward experiencing city through mixed work-leisure activities,0.5
2021-11-09,behavioral_patterns,Growing preference for multiple observation points vs single locations,0.5
2021-11-09,behavioral_patterns,Transformation of industrial spaces into food markets (Chelsea Market) reflecting changing urban usage,0.5
2021-11-09,behavioral_patterns,"Public parks being repurposed for diverse activities (reading, games, recreation)",0.5
2021-11-09,behavioral_patterns,24/7 subway usage as primary transport mode,0.5
2021-11-09,behavioral_patterns,Resistance to platform screen door adoption despite safety issues,0.5
2021-11-09,behavioral_patterns,Museum visitation patterns shifting from general history to interactive/specialized exhibits,0.5
2021-11-09,behavioral_patterns,Traditional museums struggling to maintain relevance with static/closed exhibits,-0.5
2021-11-09,behavioral_patterns,Cultural clustering remains strong driver of neighborhood selection and community formation,0.5
2023-12-21,educational_demand,Local history and architectural preservation expertise needs,0.5
2021-11-09,early_adopter_products,NYPD law enforcement operations,-0.5
2024-03-13,problem_spaces,Time constraints for visitors wanting to see Statue of Liberty/Ellis Island (requires half day minimum),0.5
2013-03-07,problem_spaces,Cultural preservation challenges as neighborhoods gentrify,0.5
2024-03-13,behavioral_patterns,"Rising phone usage disruption during Broadway shows, especially among younger audiences",0.5
2024-03-13,behavioral_patterns,"Migration toward scheduled, structured free entertainment in public spaces",0.5
2024-03-13,behavioral_patterns,Community gardens facing closure threats despite local value (Elizabeth Street),-0.5
2024-03-13,behavioral_patterns,Integration of fashion history with contemporary themes (food) to attract new audiences,0.5
2024-03-13,behavioral_patterns,Traditional tourist behaviors (Times Square visits) being supplemented with more local experiences,0.5
2024-03-13,behavioral_patterns,"Adaptation of popular media (books, movies) into stage productions",0.5
2024-03-13,behavioral_patterns,Broadway trending toward revival/adaptation formats rather than original productions,0.5
2024-03-13,behavioral_patterns,Outdoor dining transitioning from temporary pandemic measure to permanent fixture with seasonal restrictions,0.5
2024-03-13,behavioral_patterns,Increasing integration of educational content with entertainment in museum experiences,0.5
2024-03-13,behavioral_patterns,Emergence of height-based thrill experiences (The Beam) despite safety concerns,0.5
2013-03-07,problem_spaces,Post-9/11 security and safety concerns requiring ongoing vigilance,0.5
2013-03-07,problem_spaces,Cultural preservation challenges in maintaining distinct neighborhood identities within melting pot environment,0.5
2024-03-13,problem_spaces,Confusing ticket purchase interface requiring specific navigation to find City ticket discounts,0.5
2013-03-07,behavioral_patterns,"Growing reliance on foot, taxi and 24/7 subway transit for exploration",0.5
2013-03-07,educational_demand,Historical preservation and museum curation expertise needs,0.5
2022-11-28,early_adopter_products,Overstory bar (located on 64th floor Wall Street) ranked #34 on World's 50 Best Bars 2022,0.5
2022-11-28,early_adopter_products,Pre-made cocktails on tap being offered in upscale bars,0.5
2022-11-28,emerging_topics,Global bar ranking systems and lists as dining guides,0.5
2022-11-28,emerging_topics,Specialty equipment and techniques (like highball machines) in cocktail preparation,0.5
2022-11-28,problem_spaces,High-rise cocktail bars face height/location accessibility challenges,0.5
2022-11-28,problem_spaces,Need for food options alongside cocktails to avoid alcohol-related issues,0.5
2022-11-28,problem_spaces,"Price-to-portion concerns with upscale bar food (caviar, small bites)",0.5
2024-03-13,problem_spaces,Current turnstile design vulnerability allowing 'back cocking' entry,0.5
2024-03-13,problem_spaces,Late arrival issues causing disruption and requiring special seating procedures,0.5
2024-03-13,behavioral_patterns,Shift toward subway usage over rideshare during peak hours,0.5
2024-03-13,behavioral_patterns,Cost-conscious behavior shift from $40 rides to $2 subway fares,0.5
2024-03-13,behavioral_patterns,Increased reliance on visual stop tracking vs audio announcements,0.5
2024-03-13,behavioral_patterns,Move toward automated fare optimization vs prepaid unlimited passes,0.5
2022-03-22,problem_spaces,Challenge of decorating tall ceiling spaces and large bare walls,0.5
2022-03-22,problem_spaces,Cold feet by window during winter requires space heater,0.5
2022-03-22,behavioral_patterns,Growing importance of landlord pre-approval for apartment modifications,0.5
2022-03-22,behavioral_patterns,Using space heaters as targeted comfort solution near windows during winter,0.5
2022-03-22,behavioral_patterns,Delayed furnishing and decoration behavior - taking 6+ months to fully set up space,0.5
2022-03-22,behavioral_patterns,"Gradual, phased approach to home decoration rather than immediate full setup",0.5
2022-03-22,problem_spaces,Need for landlord approval and proper documentation for apartment modifications,0.5
2022-03-22,problem_spaces,Lack of built-in closets in converted living spaces requiring alternative storage solutions,0.5
2022-03-22,educational_demand,Space optimization and interior design skills for small apartments,0.5
2022-03-22,educational_demand,DIY home decor skills using affordable materials like marble tiles from Home Depot,0.5
2022-03-22,educational_demand,Urban real estate market awareness,0.5
2013-03-07,early_adopter_products,NYC Subway system - 24/7 public transit network,0.5
2024-03-13,behavioral_patterns,Growing preference for budget-friendly ferry sightseeing over expensive tour boats,0.5
2024-03-13,behavioral_patterns,Migration of theaters away from Broadway street to surrounding district,-0.5
2024-03-13,behavioral_patterns,Growing trend of using pre-purchased SIM cards or carrier international plans,0.5
2024-03-13,behavioral_patterns,Growing preference for mezanine seating over front row for musical shows,0.5
2024-03-13,behavioral_patterns,Reduced luggage-heavy travel on public transit options,-0.5
2024-03-13,behavioral_patterns,Avoidance of physical ticket machines due to long lines,0.5
2024-03-13,behavioral_patterns,Emerging pattern of waiting 10-15 minutes during surge pricing to get better rates,0.5
2024-03-13,behavioral_patterns,Peak hour pricing differential adoption for 4-8pm weekdays,0.5
2024-03-13,behavioral_patterns,Increasing practice of switching subway cars when witnessing erratic behavior,0.5
2024-03-13,behavioral_patterns,Persistent pattern of unauthorized taxi/ride scams at airports targeting tourists,0.5
2024-03-13,behavioral_patterns,Growing adoption of noise-canceling headphones for subway commutes,0.5
2024-03-13,problem_spaces,Front row theater seats cause neck strain from looking up at elevated stages,0.5
2021-11-09,educational_demand,Opportunity for cultural/historical tour guide certification and training,0.5
2023-12-21,emerging_topics,Integration of public art and cultural spaces into urban development,0.5
2022-11-28,educational_demand,Need for knowledge of specialty equipment like highball machines,0.5
2024-03-13,problem_spaces,Metro card system transition causing confusion for visitors,-0.5
2024-03-13,problem_spaces,Limited seating capacity at popular casual restaurants causing wait times,0.5
2022-11-28,educational_demand,Rising demand for hospitality business management skills for upscale venues,0.5
2024-03-13,problem_spaces,Long lines at delis/casual restaurants due to unprepared customers,0.5
2024-03-13,problem_spaces,Poor transportation decision-making during peak hours (7:30am-8pm),0.5
2023-12-21,problem_spaces,Weather dependency affects outdoor activities and attraction accessibility,0.5
2023-12-21,behavioral_patterns,Growing preference for walkable neighborhood exploration over vehicle transit,0.5
2022-11-28,behavioral_patterns,Pre-dinner cocktail visits emerging as common behavior pattern for upscale nights out,0.5
2023-12-21,early_adopter_products,One World Observatory digital interactive exhibits,0.5
2023-12-21,educational_demand,Food service and culinary arts training demand for restaurant districts,0.5
2022-11-28,behavioral_patterns,Wall Street area transforming into after-hours entertainment destination,0.5
2024-03-13,problem_spaces,Complex rules around unlimited passes create user confusion,0.5
2024-03-13,problem_spaces,City Mapper app doesn't provide accurate weekend service change information for local stations,0.5
2024-03-13,problem_spaces,Subway stations are dangerously hot in summer with poor temperature control,0.5
2023-12-21,early_adopter_products,Chelsea Market food hall and retail complex,0.5
2024-03-13,problem_spaces,AirTrain payment system confusion due to inconsistent fee waiving,0.5
2024-03-13,problem_spaces,Extra fee ($1) required for new Metro card purchase is an unnecessary cost,0.5
2024-03-13,problem_spaces,Tourist transportation inefficiency choosing wrong mode of transit,0.5
2024-03-13,problem_spaces,Tourists being unprepared for volatile NYC weather changes,0.5
2024-03-13,problem_spaces,Free activities and venues often face overcrowding due to popularity and limited capacity,0.5
2024-03-13,problem_spaces,Limited accessibility and physical demands of large attractions like Central Park requiring significant walking,0.5
2023-12-21,behavioral_patterns,Traditional yellow cab usage declining relative to alternative transport,-0.5
2024-03-13,problem_spaces,Overcrowding on Brooklyn Bridge impacts visitor experience and photo opportunities,0.5
2024-03-13,problem_spaces,Overcrowding on traditional tour buses leading to suboptimal touring experience,0.5
2023-12-21,educational_demand,Cultural education opportunities through museums and historical sites,0.5
2024-03-13,problem_spaces,AirTrain still requires physical MetroCard purchase (+$1 fee),0.5
2024-06-06,problem_spaces,"Transportation costs in NYC, though relatively low ($2.75), still present a barrier for some",0.4
2024-06-06,behavioral_patterns,Increasing preference for visually distinctive vehicles (sky blue Teslas) for easier identification,0.4
2024-06-06,behavioral_patterns,Trend toward sunset/nighttime tram rides for enhanced experience,0.4
2024-06-06,behavioral_patterns,Trend toward mobile payment systems and reloadable cards at attractions replacing traditional tickets,0.4
2024-06-06,behavioral_patterns,Rising interest in cultural/educational free activities like calligraphy classes and museum tours,0.4
2024-06-06,behavioral_patterns,More people discovering and utilizing birthday month promotions for free spa/entertainment access,0.4
2023-12-21,early_adopter_products,The High Line elevated park,0.4
2023-12-21,early_adopter_products,Brooklyn Brewery tours and tastings,0.4
2024-03-22,educational_demand,Social media content planning and weather-dependent scheduling,0.4
2021-11-09,problem_spaces,City residents rarely exploring nearby natural attractions and getaways,0.4
2021-11-09,problem_spaces,Population density pressure with 2.3M residents in Queens,0.4
2024-06-06,emerging_topics,Historic architectural elements being preserved/showcased in modern spaces,0.4
2013-03-07,emerging_topics,Historic infrastructure as cultural landmarks,0.4
2024-06-06,behavioral_patterns,All-day transit pass behavior instead of single-trip tickets,0.4
2021-11-09,behavioral_patterns,Increasing reliance on public ferry transportation for daily commutes,0.4
2021-11-09,behavioral_patterns,Adaptation of historic infrastructure for modern use (High Line park creation),0.4
2022-03-22,problem_spaces,Limited space requires creative storage solutions like using tiles as surfaces,0.4
2022-03-22,problem_spaces,High cost of professional flex wall installation ($850-$2000) pushing people toward DIY solutions,0.4
2022-03-22,behavioral_patterns,Shift toward DIY apartment modifications despite complexity and risks,0.4
2022-03-22,behavioral_patterns,Increasing use of sound-proofing materials in shared living spaces,0.4
2024-03-22,problem_spaces,Scheduling content creation around weather conditions impacts workflow planning,0.4
2022-03-22,behavioral_patterns,"Incorporating minimalistic design elements, seemingly 'accidentally' developed over time",0.4
2022-03-22,behavioral_patterns,Increased focus on privacy management with windows through strategic blind usage,0.4
2021-11-09,behavioral_patterns,Traditional urban-to-suburban migration patterns being disrupted by housing costs,0.4
2021-11-09,behavioral_patterns,Residents rarely venturing outside city limits despite nearby attractions,0.4
2021-11-09,behavioral_patterns,Transportation convenience driving housing choice and commuter behavior,0.4
2021-11-09,behavioral_patterns,Family-owned/post-9/11 established businesses showing long-term resilience,0.4
2021-11-09,behavioral_patterns,Increasing conflict between pedestrians and fast cyclists,0.4
2022-03-22,behavioral_patterns,Transition from functionality-first to aesthetics-focused decorating over time,0.4
2021-11-09,behavioral_patterns,"Rising usage of park spaces for alternative activities (yoga, meditation)",0.4
2024-06-06,behavioral_patterns,Multiple repeat visits to same attractions indicating strong retention behavior,0.4
2022-03-22,educational_demand,Building safety and occupancy certificate requirements,0.4
2022-03-22,educational_demand,Window insulation and climate control solutions for home offices,0.4
2022-03-22,educational_demand,Home furnishing and decoration planning,0.4
2013-03-07,early_adopter_products,Brooklyn Bridge pedestrian infrastructure,0.4
2024-06-06,behavioral_patterns,Growing need for theater-goers to understand awards/recognition systems (Tony Awards confusion),0.4
2024-06-06,behavioral_patterns,Increasing wait times and digital queuing systems at popular food establishments,0.4
2024-06-06,emerging_topics,"Alternative transportation methods (ferries, etc.) for urban exploration increasing",0.4
2024-06-06,behavioral_patterns,Evolution of traditional spa experiences to include unique offerings like wine baths,0.4
2021-11-09,behavioral_patterns,Shift in waste management behavior with sidewalk garbage piling becoming standard practice,0.4
2021-11-09,behavioral_patterns,Increasing presence of protest activities and activism around universities,0.4
2021-11-09,behavioral_patterns,Evolution from architectural landmarks to dedicated observation spaces,0.4
2024-06-06,emerging_topics,Pre-theater dining experiences as part of cultural entertainment packages,0.4
2024-06-06,emerging_topics,Revival of traditional bookstores as cultural institutions amid digital retail,0.4
2024-06-06,emerging_topics,Free urban entertainment and activities becoming more organized/structured,0.4
2024-03-22,educational_demand,Time management skills for flexible work schedules,0.4
2021-11-09,emerging_topics,Integration of memorial spaces with modern infrastructure,0.4
2021-11-09,emerging_topics,24/7 transit operations in major cities,0.4
2021-11-09,emerging_topics,Public transportation innovation through alternative modes (funicular/cable cars),0.4
2021-11-09,emerging_topics,Evolution of skyscraper design from art deco to contemporary styles,0.4
2021-11-09,emerging_topics,Cultural heritage preservation in modern cities,0.4
2021-11-09,emerging_topics,Tourism-dependent urban economies,0.4
2013-03-07,educational_demand,Retail/customer service skills for luxury shopping district workers,0.4
2024-06-06,behavioral_patterns,Migration from crowded tourist spots to lesser-known areas (e.g. Upper Central Park vs lower),0.4
2024-06-06,problem_spaces,"Limited awareness of free admission opportunities (e.g., NY Botanical Gardens on Wednesdays)",0.4
2024-06-06,problem_spaces,Navigation challenges in finding hidden/alternative restaurant locations,0.4
2024-06-06,problem_spaces,Construction noise interrupting filming/activities in the area,0.4
2022-11-28,emerging_topics,Urban nightlife concentration in global cities,0.4
2024-06-06,problem_spaces,Time restrictions on happy hour deals create accessibility challenges,0.4
2024-06-06,problem_spaces,Navigation and time management challenges in large museums,0.4
2024-06-06,problem_spaces,"Limited beach rental options (umbrellas, chairs) at NYC beaches",0.4
