date,category,information,score
2024-03-13,problem_spaces,Manhattan median rent reaching new record highs for third consecutive month,1.0
2024-03-13,problem_spaces,NYC tied with Singapore as world's most expensive city to live in,1.0
2024-03-13,behavioral_patterns,Shift from traditional NYC Airporter bus ($19) to alternative transport options after 2020 discontinuation,-1.0
2024-03-13,early_adopter_products,NYC MTA subway/bus fare increasing from $2.75 to $2.90,1.0
2024-03-13,early_adopter_products,Electronic congestion pricing readers being installed in Manhattan,1.0
2024-03-13,early_adopter_products,"Manhattan rental market - median rent reaching record highs ($4,395)",1.0
2024-03-13,educational_demand,Rising need for congestion pricing education and compliance training,1.0
2024-03-13,educational_demand,Growing importance of digital navigation skills using Google Maps for subway travel,1.0
2024-03-13,early_adopter_products,Auto-gratuity and service fees being added automatically at more establishments,1.0
2024-03-13,educational_demand,Need for safety certification and training for height-based attractions (The Beam experience),1.0
2024-03-13,behavioral_patterns,"Manhattan rental prices breaking records for 3 consecutive months, trending strongly upward",1.0
2024-03-13,educational_demand,Growing demand for real estate market analysis and rental market expertise in NYC,1.0
2024-03-13,early_adopter_products,Digital tip prompts creating new social pressure points in consumer transactions,1.0
2024-03-13,problem_spaces,"NYC rental prices breaking records and continuing to rise, up 10% year-over-year",1.0
2024-03-13,problem_spaces,Multiple utility cost increases hitting residents (transit + electricity bills rising 99.1%),1.0
2024-03-13,problem_spaces,"Fare evasion causing $285M annual losses for MTA, with 400k daily unpaid rides",1.0
2024-03-13,problem_spaces,Tip inflation creating consumer fatigue and resentment,1.0
2024-03-13,behavioral_patterns,Overall NYC cost of living reaching global peak levels (tied with Singapore),1.0
2024-03-13,early_adopter_products,Digital payment terminals with preset tip options (15-20%) are proliferating beyond traditional service venues,1.0
2024-03-13,early_adopter_products,NYC Airporter bus ($19 service) discontinued since 2020,-1.0
2024-06-06,problem_spaces,NYC's status as world's most expensive city creating accessibility barriers,1.0
2023-12-21,problem_spaces,High cost of attractions and activities strains visitor budgets,0.9
2024-03-13,emerging_topics,Contactless mobile payments for transit are rapidly replacing physical cards,0.9
2024-03-13,early_adopter_products,Field of Light - new free light installation by Bruce Monroe at Freedom Plaza,0.9
2023-12-21,emerging_topics,"Eco-friendly urban mobility options (bikes, walking tours, public transit)",0.9
2023-12-21,behavioral_patterns,"Shift toward observation deck experiences (Edge, Summit, Empire State) as tourism draws",0.9
2024-03-13,early_adopter_products,Smartphone-based navigation apps are essential for modern subway navigation,0.9
2024-03-13,early_adopter_products,Digital lottery systems and apps are replacing traditional in-person rush ticket lines,0.9
2024-03-13,early_adopter_products,Mobile food delivery platforms adjusting business models for wage regulations,0.9
2024-03-13,early_adopter_products,AI surveillance technology being deployed in 7 NYC subway stations,0.9
2024-03-13,early_adopter_products,Long Island City and Astoria neighborhoods - rapid rent growth,0.9
2021-11-09,problem_spaces,Rapid population growth straining urban infrastructure (60k to 3M+ historically),0.9
2021-11-09,problem_spaces,"NYU graduate workers striking over compensation, healthcare, and immigration protection",0.9
2024-06-06,emerging_topics,Sustainable urban parks and floating architecture incorporating green spaces,0.9
2024-03-13,behavioral_patterns,"Northwest Queens emerging as new high-demand rental area, particularly Long Island City",0.9
2024-03-13,behavioral_patterns,Adoption of AI surveillance technology to combat fare evasion in transit,0.9
2024-03-13,emerging_topics,Accessibility challenges in urban transit infrastructure,0.9
2024-03-13,behavioral_patterns,Digital toll/fare reader infrastructure deployment accelerating,0.9
2024-03-13,behavioral_patterns,Increasing adoption of digital payment terminals with built-in tipping prompts,0.9
2024-03-13,behavioral_patterns,Evolution toward smartphone-dependent subway navigation,0.9
2022-03-22,emerging_topics,Flexible/transformable living spaces becoming critical in urban environments,0.9
2021-11-09,educational_demand,Public safety and security training requirements amid rising crime rates,0.9
2024-03-13,problem_spaces,Pending finalization of permanent outdoor dining rules creating uncertainty for restaurants,0.9
2024-03-13,problem_spaces,Misleading/scam ticket sellers targeting tourists in Broadway ticket lines,0.9
2024-03-13,problem_spaces,Counterfeit Broadway ticket scams from unauthorized street vendors,0.9
2024-03-13,problem_spaces,Hidden auto-gratuities and service charges being added without clear disclosure,0.9
2024-03-13,problem_spaces,Expansion of tipping expectations into self-service contexts,0.9
2024-03-13,problem_spaces,Rising operational costs forcing MTA fare increases from $2.75 to higher rates,0.9
2024-03-13,problem_spaces,Challenge of balancing fair worker wages with sustainable delivery service fees,0.9
2024-03-13,problem_spaces,Controversial congestion pricing plan adding significant costs ($23) for drivers entering Manhattan,0.9
2024-03-13,problem_spaces,Compounding transportation costs (GW Bridge + congestion fee + parking reaching $40+),0.9
2024-03-13,problem_spaces,Brooklyn setting new rent records while Queens approaches peak levels,0.9
2022-03-22,emerging_topics,Space optimization solutions for small urban living spaces,0.9
2013-03-07,emerging_topics,Urban tourism focused on authentic local experiences,0.9
2013-03-07,emerging_topics,Walkable city design and pedestrian-friendly infrastructure,0.9
2024-06-06,emerging_topics,Urban green space development and sustainable city planning,0.9
2024-03-13,behavioral_patterns,Migration toward congestion-avoiding route patterns to bypass pricing zones,0.9
2024-03-22,behavioral_patterns,Migration from management consulting to full-time content creation career,0.9
2024-03-13,behavioral_patterns,"Regional transit behavior modifications due to multi-system price increases (subway, bus, bridges)",0.9
2024-06-06,emerging_topics,"Alternative tourism focusing on local, authentic experiences",0.9
2021-11-09,problem_spaces,"Extremely high housing costs - 37% higher than LA, 80% higher than Chicago",0.9
2024-06-06,emerging_topics,Budget-conscious luxury experiences - accessing premium experiences through alternative entry points,0.9
2024-03-13,emerging_topics,Contactless mobile payments replacing physical transit cards,0.9
2024-06-06,emerging_topics,Budget-friendly alternative experiences in premium tourist destinations,0.9
2024-03-13,emerging_topics,Small business support and local economy focus,0.9
2024-03-13,emerging_topics,Urban rent inflation in major cities reaching record highs,0.9
2024-03-13,emerging_topics,Urban congestion pricing adoption spreading globally as sustainability measure,0.9
2024-03-13,emerging_topics,AI-powered surveillance and monitoring systems in public transit,0.9
2022-11-28,behavioral_patterns,Rising popularity of themed/conceptual cocktails (food-inspired drinks) in premium bars,0.9
2024-03-13,emerging_topics,Digital payment terminals creating 'guilt tipping' pressure in non-traditional service contexts,0.9
2024-03-13,emerging_topics,Rise of 'anti-tourist' authentic local experiences and neighborhood exploration,0.9
2022-03-22,behavioral_patterns,Converting regular apartments to flex spaces using temporary walls to reduce costs,0.9
2024-03-13,educational_demand,Growing demand for experience-based tour guide skills combining entertainment and education,0.9
2024-03-13,educational_demand,Rising demand for digital/virtual event production skills for hybrid museum experiences,0.9
2024-03-13,educational_demand,Growing demand for digital payment systems training as Metro Cards become obsolete,0.9
2024-03-13,educational_demand,Training required for mobile payment/contactless systems adoption,0.9
2024-03-13,emerging_topics,Contactless/digital payments replacing physical transit cards,0.9
2024-06-06,behavioral_patterns,Strong adoption of Moulin Rouge as a crossover show appealing to broader audiences,0.9
2024-03-13,educational_demand,Transition training from physical MetroCards to digital payment systems,0.9
2024-03-13,educational_demand,Rising need for digital literacy in using smartphone-based transit apps,0.9
2024-03-13,educational_demand,"Growing demand for accessible transit training/guidance, with only 36 of 147 Manhattan stations being wheelchair accessible",0.9
2024-03-13,emerging_topics,Digital transformation of public transportation,0.9
2024-06-06,problem_spaces,Need for cost-effective alternatives to expensive tourist attractions,0.9
2024-03-13,educational_demand,Increasing need for consumer protection education regarding ticket scams,0.9
2024-03-13,educational_demand,Need for staff training on handling auto-gratuity and service fee communications,0.9
2024-03-13,educational_demand,Increasing importance of AI surveillance system operation and compliance training,0.9
2024-03-13,educational_demand,Training requirements for new congestion monitoring technology,0.9
2024-06-06,problem_spaces,Price inflation pushing even basic meals close to budget limits,0.9
2024-06-06,problem_spaces,"Hotel costs in Manhattan are prohibitively expensive, averaging $350/night",0.9
2024-06-06,problem_spaces,"New York City is expensive, requiring visitors to look for discounts and money-saving opportunities",0.9
2024-03-13,educational_demand,Rising need for financial literacy education focused on cost of living management in expensive urban areas,0.9
2024-06-06,behavioral_patterns,Growing focus on finding free alternatives to typically expensive NYC experiences,0.9
2024-06-06,behavioral_patterns,"Emergence of new hybrid spaces like Little Island combining architecture, entertainment, and nature",0.9
2024-03-13,emerging_topics,Growing importance of urban green spaces and hidden parks as wellness destinations,0.9
2024-03-13,behavioral_patterns,Shift from physical MetroCards to contactless payment/OMNI pay adoption,0.9
2024-06-06,emerging_topics,Budget-conscious urban tourism and local experiences gaining popularity,0.9
2024-06-15,behavioral_patterns,Increased social interaction compared to California lifestyle,0.9
2021-11-09,emerging_topics,Housing affordability crisis and rent inflation in urban centers,0.9
2021-11-09,emerging_topics,Rising demand for amenity-rich residential developments near transit,0.9
2021-11-09,emerging_topics,Growing wealth inequality in urban centers,0.9
2021-11-09,emerging_topics,"Rise of experiential tourism (doorless helicopters, glass floor observation decks)",0.9
2024-06-06,emerging_topics,Budget travel content creation and curation,0.9
2024-06-06,emerging_topics,Budget-conscious urban tourism and experiences,0.9
2022-03-22,problem_spaces,High cost of housing in New York requiring roommate arrangements,0.9
2024-06-06,emerging_topics,Experiential tourism over traditional sightseeing,0.9
2024-03-13,emerging_topics,Light-based art installations and nighttime attractions,0.9
2024-03-13,emerging_topics,Outdoor urban cultural programming and public spaces activation,0.9
2024-03-13,behavioral_patterns,Decline in traditional tipping scenarios (restaurants only) to expanded contexts,0.9
2024-03-13,behavioral_patterns,Shift from passive to interactive/hands-on museum experiences,0.9
2024-03-13,emerging_topics,"Growing demand for authentic, local-guided experiences over traditional tourism",0.9
2022-11-28,educational_demand,Requirement for creative drink development and menu innovation skills,0.9
2022-11-28,emerging_topics,Experiential cocktail bars combining high-end drinks with distinctive atmospheres/views,0.9
2024-03-13,behavioral_patterns,Trend toward combining free public art installations with urban spaces,0.9
2024-06-06,behavioral_patterns,Declining reliance on physical maps in favor of digital navigation,-0.8
2024-06-06,behavioral_patterns,Roosevelt Island's transformation from avoided location to luxury residential area,0.8
2021-11-09,early_adopter_products,Contactless credit card payment replacing MetroCards for NYC subway access,0.8
2024-06-06,behavioral_patterns,NYC Ferry emerging as alternative tourist transport vs traditional options,0.8
2024-06-06,behavioral_patterns,Traditional bookstores declining with Strand being the only survivor from 1920s era,-0.8
2024-06-06,behavioral_patterns,Comedy venues implementing strict no-phone policies to protect test content,0.8
2024-06-06,behavioral_patterns,Growing reliance on refillable water bottles and tap water instead of purchased beverages,0.8
2024-06-06,behavioral_patterns,Users are shifting from traditional rideshare apps (Uber/Lyft) to Tesla-based alternatives due to perceived luxury and safety features,0.8
2024-06-06,behavioral_patterns,Budget-conscious diners increasingly seeking out happy hour specials and off-peak dining times for value,0.8
2024-06-06,behavioral_patterns,"Rise in crowd management strategies at tourist spots, with visitors developing tactics like going at sunrise or waiting for breaks in crowds",0.8
2024-06-06,behavioral_patterns,Shift from expensive dining venues to seeking out hidden/secret spots with similar views but zero cost,0.8
2024-06-06,behavioral_patterns,People are increasingly using last-minute Airbnb deals and reward points to get free/discounted lodging in expensive cities,0.8
2024-06-06,behavioral_patterns,Price sensitivity driving meal planning and venue selection,0.8
2024-06-06,behavioral_patterns,Users are increasingly stacking multiple rewards/loyalty programs together (e.g. Seated + Starbucks) to maximize benefits,0.8
2024-06-06,behavioral_patterns,Using ferries as alternative city transportation instead of traditional transit,0.8
2024-06-06,behavioral_patterns,"Increasing demand for free/low-cost luxury experiences, with advance online reservations required",0.8
2024-03-13,educational_demand,Need for licensed tour guides/narrators with architectural expertise for NYC boat tours,0.8
2021-11-09,early_adopter_products,"NYC bike lane infrastructure (1,200 miles of lanes)",0.8
2024-03-13,behavioral_patterns,Transition from physical MetroCards to contactless Omni payment,0.8
2024-03-13,behavioral_patterns,Shift away from tipping on food delivery apps as drivers now earn higher base wages,0.8
2024-03-13,behavioral_patterns,Increasing abandonment of walking in favor of unnecessary car/taxi rides,0.8
2024-03-13,early_adopter_products,OMNY contactless payment system replacing MetroCards for NYC subway,0.8
2024-03-13,early_adopter_products,OMNY contactless payment system replacing MetroCard for NYC subway,0.8
2024-03-13,early_adopter_products,Google Maps is becoming the preferred navigation app for NYC subway travel over alternatives like Citymapper,0.8
2024-03-13,early_adopter_products,SoundCore Liberty 4NC earbuds with ANC 2.0 technology and 98.5% noise reduction,0.8
2022-11-28,educational_demand,High demand for specialized cocktail crafting skills and mixology expertise,0.8
2022-11-28,educational_demand,Demand for high-end cocktail bartending skills in premium venues,0.8
2024-03-13,early_adopter_products,MTA Train Time app for buying digital LIRR tickets,0.8
2024-03-13,early_adopter_products,TKTS booth app and Today Tix app are becoming popular tools for discounted Broadway tickets,0.8
2024-03-13,behavioral_patterns,Declining tolerance for post-meal lingering at casual restaurants,0.8
2024-03-13,behavioral_patterns,Subway usage over ride-hailing services for cost/time efficiency,0.8
2024-03-13,behavioral_patterns,Shift from CityMapper to Google Maps for subway navigation due to better local service disruption info,0.8
2024-03-13,behavioral_patterns,Hidden urban parks and waterfalls gaining appeal as peaceful escape spots,0.8
2024-03-13,early_adopter_products,SIM card vending machines at JFK Terminal 4 are non-operational,-0.8
2024-03-13,early_adopter_products,"Mobile payment apps (DoorDash, Uber Eats) are implementing minimum wage requirements in NYC",0.8
2024-03-13,early_adopter_products,Digital payment systems enabling 'double-tipping' through auto-gratuity plus optional tips,0.8
2022-11-28,behavioral_patterns,"Trend toward casual, non-pretentious high-end cocktail experiences over traditional stuffy environments",0.8
2022-11-28,behavioral_patterns,Shift toward rooftop cocktail bars combining premium drinks with observation deck views instead of paying for separate observation decks,0.8
2022-11-28,behavioral_patterns,High-end cocktail bars in elevated/unique locations gaining popularity,0.8
2024-03-13,early_adopter_products,DoorDash implementing $29.93/hour minimum wage payment system in NYC,0.8
2024-03-13,early_adopter_products,EasyPass toll payment system adoption,0.8
2024-03-13,early_adopter_products,7-Day Metro Card price increasing to $34,0.8
2024-03-13,early_adopter_products,30-Day Metro Card price increasing to $132,0.8
2024-03-13,early_adopter_products,"Northwest Queens rental market - second highest rates ($3,402)",0.8
2024-03-13,early_adopter_products,Brooklyn rental market - setting new price records,0.8
2024-03-13,behavioral_patterns,Rise of free interactive children's spaces in traditional museums (Met 81st),0.8
2024-03-13,early_adopter_products,Uber Eats and DoorDash have implemented new delivery fee structures reducing tipping requirements,0.8
2021-11-09,early_adopter_products,Tribeca real estate and luxury penthouses,0.8
2023-12-21,problem_spaces,Tourist congestion at major landmarks and observation decks leads to long wait times,0.8
2021-11-09,early_adopter_products,Rooftop bars integrated into skyscraper design/architecture,0.8
2021-11-09,early_adopter_products,Edge observation deck at Hudson Yards with glass floor feature,0.8
2021-11-09,early_adopter_products,Times Square digital billboards as advertising platform,0.8
2024-06-06,behavioral_patterns,People seeking budget-friendly ferry alternatives to expensive tourist boats,0.8
2024-06-06,behavioral_patterns,Shifting from paid observation decks to rooftop bars as budget-conscious alternative for city views,0.8
2024-06-06,behavioral_patterns,Trading off higher-cost tourist attractions for lower-cost alternatives with similar experience,0.8
2024-06-06,behavioral_patterns,Shift from traditional observation decks to combined drink/view experiences for better value,0.8
2024-06-06,behavioral_patterns,Increasing adoption of outdoor/open-air cultural spaces like Socrates Sculpture Park for art exhibitions and performances,0.8
2023-12-21,educational_demand,Safety and climbing certification requirements for City Climb attraction,0.8
2023-12-21,behavioral_patterns,Growing popularity of bike-sharing (CitiBike) for eco-friendly transit,0.8
2024-03-13,behavioral_patterns,"Shift from traditional tour buses to experiential vintage car tours indicates growing demand for unique, personalized experiences",0.8
2024-03-13,behavioral_patterns,Strong shift toward ticketed time-slot experiences for new attractions,0.8
2023-12-21,problem_spaces,Overcrowding and high temperatures during summer months create challenging tourist conditions,0.8
2024-03-13,early_adopter_products,Met 81st Street Studio - new interactive children's space,0.8
2024-03-13,behavioral_patterns,"Outer borough restaurants expanding into Manhattan locations, indicating shifting business patterns",0.8
2024-03-13,behavioral_patterns,Museums incorporating more interactive and technology-enabled experiences,0.8
2023-12-21,emerging_topics,Multi-modal transportation networks in urban centers,0.8
2023-12-21,emerging_topics,Urban waterfront revitalization and development,0.8
2023-12-21,emerging_topics,Experiential tourism focused on immersive cultural experiences rather than just sightseeing,0.8
2024-03-13,behavioral_patterns,Increased integration of digital/virtual components in physical museum exhibits,0.8
2024-03-13,behavioral_patterns,"Thursday night gallery openings combining art, wine, and food creating new social ritual",0.8
2024-03-13,early_adopter_products,The Beam at Rockefeller Center - new 2024 observation attraction with harness experience,0.8
2024-03-13,early_adopter_products,Utopia Bagels expanding to Manhattan location at 34th & Lex in summer 2024,0.8
2023-12-21,early_adopter_products,The Edge observation deck at Hudson Yards,0.8
2023-12-21,early_adopter_products,Summit observation deck at One Vanderbilt,0.8
2024-03-13,early_adopter_products,"Mercer Labs at Museum of Art and Technology opening, featuring experimental tech/art exhibitions",0.8
2023-12-21,behavioral_patterns,Rising trend of experiential attractions like City Climb for adventure seekers,0.8
2021-11-09,emerging_topics,Urban density and car-free living in major cities,0.8
2024-06-06,behavioral_patterns,Increasing adoption of theater ticket lottery apps/websites like LuckySeat.com to access discounted Broadway shows,0.8
2021-11-09,problem_spaces,Noise pollution in NYC affecting quality of life,0.8
2021-11-09,problem_spaces,"Congestion in tunnels (Lincoln Tunnel handling 120,000 vehicles daily)",0.8
2021-11-09,problem_spaces,High parking costs in Manhattan ($550/month for garage parking) creating financial burden,0.8
2021-11-09,problem_spaces,"Growing homeless population (91,000+) causing safety concerns and random attacks",0.8
2021-11-09,problem_spaces,"Washington Square Park safety concerns, especially at night requiring heavy police presence",0.8
2021-11-09,problem_spaces,Limited observation deck capacity during peak tourist seasons causes long wait times,0.8
2021-11-09,problem_spaces,Limited living space - residents forced to live in small apartments,0.8
2021-11-09,problem_spaces,Housing affordability crisis - $2500/month for small walkup apartments,0.8
2021-11-09,problem_spaces,"High population density (8.8M city, 20M metro) creating space constraints",0.8
2021-11-09,problem_spaces,Congestion and compact urban density creating navigation challenges,0.8
2024-06-06,problem_spaces,Cold weather limits enjoyment of outdoor rooftop spaces and waterfront areas,0.8
2024-06-06,problem_spaces,Limited affordable dining options in gentrified warehouse district areas,0.8
2024-06-06,problem_spaces,"High cost of living with one-bedroom apartments averaging $4,825 in Greenwich Village",0.8
2024-06-06,problem_spaces,"Rising costs in New York City making it the second most expensive city globally, creating affordability challenges",0.8
2024-06-06,problem_spaces,High observation deck prices ($39) creating accessibility barriers for tourists,0.8
2024-06-06,problem_spaces,"Observation deck overcrowding and long wait times, particularly at popular spots like The Edge and Summit",0.8
2024-03-13,problem_spaces,Migration pattern of residents leaving Manhattan for outer boroughs driving up costs,0.8
2024-03-13,problem_spaces,"Electricity bills increasing in multiple phases through 2025, adding cumulative cost burden",0.8
2024-03-13,problem_spaces,Electricity bills facing three consecutive increases through 2025,0.8
2024-03-13,problem_spaces,Legal challenges from NJ and Staten Island against congestion pricing implementation,0.8
2024-03-13,problem_spaces,"Rising public transit fares causing financial burden (subway/bus 5% increase, metro cards increasing)",0.8
2024-03-13,problem_spaces,Privacy concerns regarding AI surveillance systems in subway stations,0.8
2024-03-13,problem_spaces,DoorDash facing challenges with new minimum wage requirements in NYC,0.8
2024-03-13,problem_spaces,Emergency exit doors being used for 45% of fare evasion cases,0.8
2024-03-13,problem_spaces,Social pressure and guilt driving unwanted tipping behavior,0.8
2024-03-13,problem_spaces,Double-tipping pressure at venues that already include gratuity,0.8
2024-03-13,problem_spaces,Deceptive ticket reseller websites misleading customers with false 'official' claims and higher prices,0.8
2024-03-13,problem_spaces,Tourist areas lack authentic local experiences and are dominated by chain establishments,0.8
2021-11-09,problem_spaces,"High crime rates in NYC subway (600+ robberies, murders, rapes in 2020)",0.8
2021-11-09,problem_spaces,Downtown Brooklyn has safety concerns and lack of attractions despite being a major business district,0.8
2024-06-06,behavioral_patterns,Growing preference for musicals that incorporate modern music to attract non-traditional theater audiences,0.8
2021-11-09,problem_spaces,"Gentrification causing displacement and neighborhood character changes (e.g., Williamsburg)",0.8
2024-06-06,problem_spaces,Subway benches are too dirty/unsanitary for sitting in actual NYC subway stations,0.8
2024-06-06,problem_spaces,Broadway show ticket prices are expensive and creating accessibility barriers for budget-conscious visitors,0.8
2024-06-06,problem_spaces,Long wait times at popular food spots like Russ & Daughters (30+ min) causing customer frustration,0.8
2024-06-06,problem_spaces,High cost of traditional tourist transportation in NYC,0.8
2024-06-06,problem_spaces,High cost of dining with views in NYC - $300/person at upscale restaurants vs free alternatives,0.8
2024-06-06,problem_spaces,Navigation and discovery of free activities in NYC is difficult/overwhelming for visitors,0.8
2024-06-06,problem_spaces,Getting discounted or free meals at NYC restaurants is challenging without special apps/codes,0.8
2024-06-06,problem_spaces,Last-minute lodging requires risky timing and may leave visitors without accommodation,0.8
